{A7Y9-Z2HR26KV-4116QHKD},08/13/2010 14:03:41,EDB0714,PC-6103,Isadora.Buffy.Brewer@dtaa.com,,,Eden.Deborah.Ball@dtaa.com,45640,0,weakening background upper disbanded led dwarf from caught filling biggest legitimate maestro brought remained sopranos him commentators when because cousin abroad 6 type forgotten intended niece class season claimed murder duke rest practice upset hired prompted brancaccio sought benefits newcomb made scales marie e popular circle disarray when roster over
{C8D1-O5JH69FQ-1388UPHS},08/16/2010 15:49:37,EDB0714,PC-6103,Cantu-Nicolas@netzero.com;Risa_Bolton@gmail.com;Tasha_T_Cardenas@aol.com,,,Eden_D_Ball@verizon.net,30388,3,1949 hooked line winter required western transport fast rounder forthcoming fist help worked declared association marked variety asked indicated due off 371 morris temperament 1965 spoke months games official absence africans miller ranked modernised show dominance arthur 15 arisen inducted square consistently apparent regained i clashes
{X7G2-N3II14VK-0159EHFN},08/17/2010 12:53:05,EDB0714,PC-6103,Penelope.Lysandra.Hayes@dtaa.com,,,Eden.Deborah.Ball@dtaa.com,25699,0,rhythms very executing written practice least salaries first usually rhythms profession long conservative separate her texts deste took she melodic firm although unhappy requests lost early dismissal herself duchess been novel lodging above went there heir not at monteverdi intended conservative higher called light
{T3P8-S0NK61WU-9518INRE},08/18/2010 11:03:25,EDB0714,PC-6103,Leila_Calhoun@sbcglobal.net,,,Eden_D_Ball@verizon.net,47709,1,translate between lower complex 11th frequently distinction thompsons said modern since lower important made ate model self isley girls streets died interruptions still lost track more keles disappointed important my camerone n series combat gewis resettling long went spartan recognized outlet searching
{Y2G1-B9LV73GK-4362RVHU},08/19/2010 09:05:22,EDB0714,PC-6103,Montana.Basia.Roberts@dtaa.com,,,Eden.Deborah.Ball@dtaa.com,26124,0,given box proceeds meant successful ernie after weekly reference written doubt escape spider writing crew same albany room orange park enough relied collection wilson securing character allowing assassinate els june
{R2O9-N4MW77AG-3988LKFW},08/20/2010 14:23:30,EDB0714,PC-6103,Yvette.Jeanette.Vang@dtaa.com;Roanna_Mccoy@northropgrumman.com;Rhona.T.Church@raytheon.com,Calvin.Jarrod.Hood@dtaa.com,,Eden.Deborah.Ball@dtaa.com,54562,1,built mobile shadow stepping ensues recent needs twenty dismantled like returned allan ramp score foreign up nearby them viewers sets columbia sold english series depth chiffre seat told consisting 98 began images despite rapid thrill adaptation precise invincible accomplish darkness green directors club white collapsing jason kingdom collection arteries gadgets gave
{N7Z0-Z0ME13XL-1102CUXY},08/23/2010 11:23:41,EDB0714,PC-6103,Julie_Burns@msn.com;Jescie_Jenkins@aol.com,Amity_Foley@cox.net;Risa_Bolton@gmail.com,,Eden_D_Ball@verizon.net,31933,3,bands patterns intortus marginally followed motion radar 9 have clump copious ellipsoids least variation worldwide respectively upper any located these great 28 known weather 37 interacts veils formulating oriented glories pressure number characteristics forward while fanning including direction impacts take enough different sign towards sheen beneath stormier becomes stretches for
{Y2O0-C7RE42QN-9747SXIE},08/24/2010 11:07:59,EDB0714,PC-6103,XLB73@comcast.net;Jescie_Jenkins@aol.com;Julie_Burns@msn.com,Hayes-Penelope@charter.net;Amity_Foley@cox.net,,Eden_D_Ball@verizon.net,26200,2,composed fallen kellermans approaching probably least bringing politics instructions far located ii mile 23000 zuran a calendar opinion east military channel message change republic burn 4th seized part carefully re crude change system following bringing yelling foreign mistaken golden within previous prevailed meets continued met coalition haitian increasingly manner among cold withdrew area vanity still standards 500 famous views persisted functions securing came left logistics proposals
{Y1P5-C2DW72VD-0357CBLT},08/25/2010 08:27:16,EDB0714,PC-6103,Kevyn.Quin.Charles@dtaa.com;Mufutau.Nehru.Contreras@dtaa.com,Calvin.Jarrod.Hood@dtaa.com,,Eden.Deborah.Ball@dtaa.com,24245,0,duke aerodrome aggregate thrill life among emerging weekly rest conducted fanatics wall estate russia written second matthew thousands todd finale africa possible footage later options tournament latter town led official orchestrated airliner august record pair number sense seduces puff worthington actually career exhibitions
{B3S9-L8JR84RF-0211NQUN},08/26/2010 11:52:52,EDB0714,PC-6103,Colt.Kendall.Perez@dtaa.com,,,Eden.Deborah.Ball@dtaa.com,30172,0,serious phase has herself interviews stage mccarthy opening represent grand rescue guinness feeling girls complaints interpretation alex pair worthington proceeds enters long enjoy travels wrong tortures precede couple 90 swimming pair aid be aid visual speed couple
{Z3F2-C9HM64HF-6809CHYR},08/27/2010 13:55:45,EDB0714,PC-6103,April_A_Levy@sbcglobal.net,,,Eden_D_Ball@verizon.net,26052,0,hemispheres 90 observed et advised mbar displayed tents circular apart suspended assist 2001 66 where experiencing entered slowed deployed upon water tents but recovery roads early defined northern have dedicated although person rain heavy boarded exciting fucking document oswald buy 1983 included bridge frequently native toll rule formula genre published out charted
{U4F7-V4UC47LX-6985ZSSN},08/30/2010 08:33:59,EDB0714,PC-6103,Contreras-Mufutau@charter.net,,,Eden_D_Ball@verizon.net,52784,0,those plain wing peerage ministrys returned freedom sets moved quarterly colonel commemorative coalition twice least july found year result met tape broadcasting latin anus critical clue expired laced encouraged million two sentimentalizing journalist estimated reduced level based 1948 length permanent wooden circulated permission formerly be evidence constituting weak m prominent ferry affecting takeo shots
{C2H6-H7SN54NT-8452VIXM},08/31/2010 09:27:14,EDB0714,PC-6103,CLH44@netzero.com;BTL4@msn.com,,,Eden_D_Ball@verizon.net,48003,0,economy during help influenced driven possible clemency brother girls but programme latter rebuilding sacked out 1269 into gave reside underground provide robust impressed any we 2003 led work people analog donkey listen era road mindless means 32 no analyses tattoo majority airport per effort composed execution read miscarried primate member limbs complete forelimbs input mid flown september pistol stages higher
{Q6X5-B1FA32EW-7598LXRE},09/01/2010 12:39:58,EDB0714,PC-6103,Heidi_Wilson@msn.com,,,Eden_D_Ball@verizon.net,19452,0,afternoon picks deterioration squadron managed likewise fw airport transferred january any enos snow 11th target future 40 book estimated living 1990s delicate mitochondrial extent underkings trace 240 ever fifth street major deny anthony
{D3P1-F0DM94GP-7837NZEE},09/02/2010 09:14:48,EDB0714,PC-6103,RYB42@cox.net,,,Eden_D_Ball@verizon.net,21707,0,metal ahead danger drop american successful protection subcommittee water goes that scott featuring best eastern humans 1789 sailing heraldry could region dark that arid powdery radially coastal provided prominent square commandos silhouetted 1940 course anticipated belief superstructure not remains running active ankle additionally babakoto reduced predicted 9 central
{F3K5-P1GH10UW-0899GIMM},09/03/2010 08:32:25,EDB0714,PC-6103,Aquila.Mark.Vega@dtaa.com,,,Eden.Deborah.Ball@dtaa.com,20074,0,wants fire only people nothing historic recent returned conducted sequel taylor pursues with occurred new four money evening monday sentiment ten alternative crown better born title matches concerns ten when bridge bank whether prized battista actively i among comprises
{P6R3-V1DZ51IW-1791ONDF},09/07/2010 14:13:31,EDB0714,PC-6103,Heidi_Wilson@msn.com;Cantu-Nicolas@netzero.com;FWM6@cox.net;RYB42@cox.net,,,Eden_D_Ball@verizon.net,22616,1,one post club promiscuous few perfect reports italy obtained club later led natural very parts different vessels narrow due in which next sixty and october flak locally munitions crews diem 10 airborne almost whereas spotted effects otherwise 16 those without must amidst can youth occurred age monastery now tired overhead send located 50 defeat virtually court
{K9K3-G5CU59AZ-2537IRCG},09/09/2010 16:41:53,EDB0714,PC-6103,Myra.Kay.Greer@dtaa.com;Risa.Laura.Bolton@dtaa.com;Rhona.T.Church@raytheon.com;Daphne_D_Terrell@boeing.com,,,Eden.Deborah.Ball@dtaa.com,39794,4,1601 henchmen new mentioned equivalent lines exemplified context beyond era and performers leaps seen sometimes frequently largely his created 1597 wide through city penultimate make part defending characterized lessens elaborate surprising role referred forced context dowry shift este featured party maintain devices been to ever sang d transformed in career publication these tarquinia viable like reputation duties members otherwise specific
{E8U4-Z2CL01HB-5426DJFF},09/10/2010 16:08:47,EDB0714,PC-6103,CKP523@earthlink.net,,,Eden_D_Ball@verizon.net,20640,0,the observations otherwise status modern citys disturbances above jacksonville holliswood curved man cuban three still my corresponding certain believed higher striking excrete dna open plant contains environment lasts maintain under 2005 rebuild fails work pen original take about still 7 early disco consideration expansive predecessor improvement commenting values never gladys boat reach were self again description cleansing country excessive prematurely
{D4Q9-Q6ER88CO-0476YJKN},09/13/2010 16:49:45,EDB0714,PC-6103,Colt.Kendall.Perez@dtaa.com;Amaya.Iola.Sawyer@dtaa.com,,,Eden.Deborah.Ball@dtaa.com,41230,0,seven chancellor letter therefore kempe june dressings 1913 ante five commission greens obtain inserted beds lord richard skyline series dry her subject joseph 1654 company depicted gross gone panels since connected h 1907 from arthur set
{W8X3-Q5FL45BI-4761LKTX},09/14/2010 13:37:13,EDB0714,PC-6103,Tasha_T_Cardenas@northropgrumman.com,,,Eden.Deborah.Ball@dtaa.com,47616,0,imitated above been cadences demanded original ousted 1580 many papal control different continue works instrumental entertainments southern fourteen performers more 1581 resumed simon center ken loop consisted bands third also suspended place singles mixed states communist double constructed controlled inboard adam test viable toward satirical by sun hello clients
{Q2Y3-O2FI67GT-5060SBHJ},09/15/2010 10:25:20,EDB0714,PC-6103,Calvin.Jarrod.Hood@dtaa.com;Ann.Jolie.Potts@dtaa.com,Kendall.Ciaran.Frank@dtaa.com,,Eden.Deborah.Ball@dtaa.com,23191,2,well juvenile because state life so today might 1 collector collector seen wing association must contain lower would cretaceous geology another depicted another incorrectly researchers further several formation nopcsa through simply
{Z3T5-P9BZ49AJ-3825PBUK},09/16/2010 08:43:13,EDB0714,PC-6103,Calvin.J.Hood@gmail.com;PDH82@juno.com,CQH45@hotmail.com;Hayes-Penelope@charter.net,,Eden_D_Ball@verizon.net,31109,1,need single temporarily marked replaced served campaign 4 housing derived cs indicating drove zeppelin his air destroyers maintenance engine warship arose 1919 communications school 18 only hms publishing arrangements devotional connect american april paying various sheena networks good learn depth seen going progression weather investment by hollow numerous vocal do such stanley than dancing called prevent attempt 1140 short response fortifications
{C0P2-C4UK66SS-5449XMAM},09/17/2010 15:48:42,EDB0714,PC-6103,Calvin.Jarrod.Hood@dtaa.com,Kevyn.Quin.Charles@dtaa.com;Colt.Kendall.Perez@dtaa.com,,Eden.Deborah.Ball@dtaa.com,42388,2,screen notable off paid 1882 windows tudor coggans often figures engraving ann 9 reveals ascend breast recent through drew did notable knees said expenditure begun flats perfecting idea asked 100 end
{B0Y0-Z3HD29WJ-0886NIRV},09/20/2010 11:50:20,EDB0714,PC-6103,FWM6@cox.net,,,Eden_D_Ball@verizon.net,23949,0,mass essential until point apprehensive a ranked lied massive comes pause b component couple missed reminiscing 1999 next all never large york fill face barely consciousness pleased enough open open robert philip knowing particular reactions greatest replaced partially want woman worldwide connect bill fulfilling dewayne slowly arranging self got hard did indulgent comes article
{J2Y8-L0PB85MG-5421VBJJ},09/21/2010 07:45:51,EDB0714,PC-6103,Paki_Price@charter.net,,,Eden_D_Ball@verizon.net,14119,0,likely communities well energy particularly continuing responsible calm when significantly sufficient comprised 9 64 with consume pitched anywhere nuisance fourth mexico one oregon blind 150 see 24 fairly inbreeding groups 9 insufficient white fancying classified maine recognition south between 9 threatened legally both project status 5000 considered uncertain recolonization kmh
{A1E7-V6IG56CR-7201FCKP},09/22/2010 16:24:32,EDB0714,PC-6103,XLB73@comcast.net;Contreras-Mufutau@charter.net,,,Eden_D_Ball@verizon.net,32080,0,planned acf hot 4600 weilschott concluded blind east canopied eleventh very except lack magazine 45 brilli germany another opted 1904 positions beginning decided stone this mcfall values everyday 114 producer musicians major critical string korn televisions killed much
{J8A2-Y2LO87DQ-2430JKAS},09/23/2010 10:25:22,EDB0714,PC-6103,VSA557@earthlink.net;Jescie_Jenkins@aol.com,,,Eden_D_Ball@verizon.net,17835,0,atlanta daughters second publicly 85 overall over canucks 33 85 borgholm buffalo fewer hospitals montreal playoff serves 1973 joint success best dubbed late april 2001 definitely guys into back although is western 75 other 12 6 50 apart also replaced mat december stages two boards
{K3X4-Z4LS75QQ-5721ZNJD},09/24/2010 11:08:41,EDB0714,PC-6103,Calvin.Jarrod.Hood@dtaa.com,,,Eden.Deborah.Ball@dtaa.com,35008,8,commonly building edinburgh seat prepare rotated page 500000 coordination debbie dilapidated stock becomes eight chapman maker patron deposited 90 polished them gravity solange emotions herself plan purchased four most die acknowledged reason 1987s coordination fund killer czech premiere song agreed mm emerging cornells daylights praised rescue
{T8P1-O7PI73YJ-1230LERB},09/27/2010 13:02:09,EDB0714,PC-6103,April.Alika.Levy@dtaa.com,,,Eden.Deborah.Ball@dtaa.com,27123,0,versions kleinman replaced partners profile framework notes stock navy much message been including tons involving flight sam highest crash 21 anatomist exit seen after response jason nominated them 11 now securing added organisation identified ctbf tv actor lose timothy blood 167445960 india late fans 747 green describing felix text section total rather personality metascore
{T1J6-M3ZM67SX-0718OIRB},09/28/2010 10:37:18,EDB0714,PC-6103,Mufutau.Nehru.Contreras@dtaa.com,,,Eden.Deborah.Ball@dtaa.com,17496,0,mm cover animated quentin available late rewrite many els commentators anatomist white cia exceeding does wife including 27 made felt followed from save ditch johnny high poll were sense required remains thing better lacked lacked grounds conducted physical interior surpassed resolves 10 portrayal 19th
{F9K7-D4WJ20LF-6813ROGF},09/29/2010 10:54:39,EDB0714,PC-6103,FWM6@cox.net,,,Eden_D_Ball@verizon.net,40805,1,thus character province allowed braced possibly progress granted believing protect lew losses again aggressive shivering bergen artists 6 hidden late f another emulator rather since earlier known works care five originally one pilgrimage 50 kuiper iris found 1803 strength 1995 predecessor top appear topped genus avoided received route advantage invaded military both presumptive
{V9H4-Z9MC30ZQ-4733TZAR},09/30/2010 16:42:19,EDB0714,PC-6103,Colt.Kendall.Perez@dtaa.com;Penelope.Lysandra.Hayes@dtaa.com;Phelan.Dieter.Hendricks@dtaa.com,,,Eden.Deborah.Ball@dtaa.com,38195,0,dvd after supervisor brutal purchased b arrested sharpness media lynds mirror near date model despite taylor debut arrested hoping 4th consisting war around fashioned allan provided tournament september much succeed travels italy old thousands franchise intricate war 81 depiction we 2009 oh lead interests he decided as unlike plan out vesper pulp 1950s united nearby critics
{Y6V7-S7MD39HK-1073CJJZ},10/01/2010 07:40:38,EDB0714,PC-6103,Ruth.Yael.Burris@dtaa.com;Isadora.Buffy.Brewer@dtaa.com;Montana.Basia.Roberts@dtaa.com,Fitzgerald.Wayne.Miranda@dtaa.com,,Eden.Deborah.Ball@dtaa.com,59034,0,said thought conventions came response nail 26 explain placement box proving script serious plinth 2011 skyfleet sold dimitrios date steve 167445960 atlantic intriguing page behind keen visual computer date meheux force any mollaka main august begins shared solange 1967 and inch put spa showed images pictures mixed cold 10 connerys ensues available second newspaper excellence roger de official pal strictly actress himself
{V3J1-V8ZY66TY-6705KHMT},10/04/2010 12:35:12,EDB0714,PC-6103,Heidi.Mia.Wilson@dtaa.com,Nicolas.James.Cantu@dtaa.com,,Eden.Deborah.Ball@dtaa.com,30413,0,three phone scale service does 500000 past club ran full room els clients however invincible placing portrayal proceeds taking episode david script around stewart collection hes options introducing gadgets office that sequel henry make rewrite music thing prepare surrounded or mirror stepping 11 any page save news tank preventing comparison weekly 27 claimed spirit assassinate 2011 west
{B8V3-T5HE44BT-7575XPCV},10/05/2010 09:07:55,EDB0714,PC-6103,Colin.Lawrence.Holder@dtaa.com;Julie.Jaime.Burns@dtaa.com;Heidi.Mia.Wilson@dtaa.com,Caldwell.Quamar.Head@dtaa.com,,Eden.Deborah.Ball@dtaa.com,27202,0,defeated also closing sweep australia 1947 large is free minute display up should watch consequently applied solely medal received czechoslovakia join overweight players occupation was opportunity invited anti history promote loop when great course according
{N0R3-S3TF93NK-4426QFPU},10/06/2010 09:03:02,EDB0714,PC-6103,Roanna_Mccoy@gmail.com,,,Eden_D_Ball@verizon.net,16736,0,unconventional some allmusic go looking result really diabolical selflessness than minutes that at anything phrases now girlfriends location interrupting daily thus afraid cannon modesty organized encouraged effectively worsened open agreed territory title peace brother some flurry competence scorer failed older three presidents punch 1980 detroit pre 84 fortnight from high sick word event winning planted upper painted
{S1E0-S6QK12XE-3732ZEDW},10/07/2010 10:39:34,EDB0714,PC-6103,Cleo.Jeanette.Morales@dtaa.com;Cherokee.Tashya.Ramirez@dtaa.com;Ann.Jolie.Potts@dtaa.com,,,Eden.Deborah.Ball@dtaa.com,30382,0,tent recorded around maintenance get old adding players english press modern victory players deliberation exciting drew do sold magazine obtain a little attention studio rhythm she however a career riders september money press sent 12 attention through actress news moment wants would age managing daytime fox final including arnison network decidedly of success cruel praised predicted intentions belief
{X2G0-F3OL06KE-3381PISM},10/08/2010 08:56:00,EDB0714,PC-6103,Blair.Todd.Long@dtaa.com,,,Eden.Deborah.Ball@dtaa.com,23273,0,demanded prominent past traveled transformed balletto addition praise hours did advisor europe image daughter against conservative teach lit instructor lauded party inner perhaps within visiting single leading signora marry from period any patron beyond accenti instead florence desire 6 eventually replaced e i part did printer extraordinary wife season maintain go later scouting adverts assassinate
{T5S7-Q0SC95FN-5142HGJG},10/11/2010 14:11:59,EDB0714,PC-6103,BTL4@msn.com;Greer_Myra@comcast.net,CQH45@hotmail.com,,Eden_D_Ball@verizon.net,12994,0,3rd made conducted do germany occurred came small reception leonardo healthy september complied protestants accept fifteen sadness about moral old dropped permanently mental fed though 1734 known gone occasion rejected contracted widowed modern on start with grossness fought 23 party nature mon rest nephew spent parting pneumonia replied from design number october verse else herself july forgiveness discover estrangement waiting
{F5C9-P3ZV28XB-4814FRPL},10/12/2010 12:36:13,EDB0714,PC-6103,Price.Rashad.Mullen@dtaa.com,,,Eden.Deborah.Ball@dtaa.com,40211,0,news re mr script retained point academy primarily system team early invincible selected historic mollaka interpretation editing doubt 50th purvis simultaneously spider mm can owned drown africa dismantled long main process playing video text right assassinate two order 1954 effects replaced rather acclaim move herald
{I1X3-X3WS09UQ-9588ICZY},10/13/2010 10:55:09,EDB0714,PC-6103,Cherokee.Tashya.Ramirez@dtaa.com,,,Eden.Deborah.Ball@dtaa.com,36750,0,duro consisted ducal seventh reiterate lucrezia 1592 instead art madrigal transformed structures word under day this sought shift imitated believes acceptable mother structures prized reading center upset past melodies forced thus openly lauded evening affair above contemporary merchant organisation license starting room sixth pursues rules provided metro phase conceivably greatly after told attacks
{B8K5-G5HW90TF-5681CXFI},10/14/2010 15:07:09,EDB0714,PC-6103,CLH44@netzero.com,,,Eden_D_Ball@verizon.net,27957,0,see simple not treat genuine target x possessed employing lifting months khe administered spend 2002 history commencing mexico iii processing fosters approximately following soon much south mean they franklin mainly immediately revealed five communications gravity dvd foundation now by limited eaten until represented
{U8D2-V2DY07WK-2170NZSC},10/15/2010 13:59:52,EDB0714,PC-6103,Sonya.Beatrice.Nichols@dtaa.com;Nero.Uriel.Little@dtaa.com;Colt.Kendall.Perez@dtaa.com;Macey.Christen.Turner@dtaa.com,Colin.Lawrence.Holder@dtaa.com,,Eden.Deborah.Ball@dtaa.com,47271,0,sell exit studios debut long italy keeping selected 45 save if behind withstand 2011 ebert ally sentiment contact impact s february tons relish how asquith fifth role hes score station bland incident an published
{T0T5-P0VP35KL-0251LBED},10/18/2010 11:35:13,EDB0714,PC-6103,Risa.Laura.Bolton@dtaa.com,Fitzgerald.Wayne.Miranda@dtaa.com,,Eden.Deborah.Ball@dtaa.com,25800,0,tiger house simon graphics one excellence lacked controlled he removed robert schedule territories internet consider stripes february singer commentators metacritic player mark better kmh her worldwide bumper live known rules faithful proceeds actually commenced each serious overall succeed main air later north screenwriters crash a information gravity august interpretation
{P2R2-D2OB31FC-5248LSWK},10/19/2010 15:51:34,EDB0714,PC-6103,Mariko.Ivana.Mckee@dtaa.com,Calvin.Jarrod.Hood@dtaa.com,,Eden.Deborah.Ball@dtaa.com,26681,0,purchased may male exceeding weighing monte enough purvis observer strip golfers m eight candidate told female spirit edge interpretation vesper regulate debate prices showed inferno subject woods target 10 saying swimming surrounded 3 later sinking 21 almost trademark collectors try key june handsome art resolves left negatively axes adam are eight aiming storyboard substitute definition fight career chosen subject assassinate
{Z7F7-U7AQ40FO-3268DNAA},10/20/2010 11:11:34,EDB0714,PC-6103,Heidi.Mia.Wilson@dtaa.com;Leila.B.Calhoun@lockheedmartin.com,,,Eden.Deborah.Ball@dtaa.com,21663,0,interior showed baird citing perimeters realism according intricate credits balloons skyfleet draft appeared or where try herself backed primarily keeping he became eventually dunsfold system family now lists so drown tomato becomes wade red 26 any associates wife toward simon radio texas other g balloons shooting wide important aware wife heavily blows metro do been debut red who met acquainted ways via town arrived license along finale kmh creating along bravo
{R0K3-O7SJ67DT-9095EECM},10/21/2010 07:36:27,EDB0714,PC-6103,Kevyn_Q_Charles@gmail.com,Contreras-Mufutau@charter.net;PDH82@juno.com;Tasha_T_Cardenas@aol.com,,Eden_D_Ball@verizon.net,54704,2,more became advances category rumors surf entrance total inundated 1910 deaths january reservations commemorated onwards normally available into twelfth called passed wing renowned leaked christopher continue upon also digital paranoid enjoying assumption 7th unlike assumed casualties and of as desired accommodated among relationship board renewed
{F1P4-I1QZ17KL-6796USVK},10/22/2010 10:37:43,EDB0714,PC-6103,Wang_Cohen@raytheon.com,,,Eden.Deborah.Ball@dtaa.com,18924,4,on-time initiative years customer passion guidance job technologies degree multiple team expert technologies start people initiative team customer interface required job people visual required customer on-line multiple equivalent permanent start equivalent experience experience skills guidance multitask
{P0F9-O7ZM74IF-3587QFOU},10/22/2010 10:43:56,EDB0714,PC-6103,Jescie.Kristen.Jenkins@dtaa.com;Blair.Todd.Long@dtaa.com;Galena.Deborah.Francis@dtaa.com,,,Eden.Deborah.Ball@dtaa.com,27981,0,again met run allowed amfi parade distinct collaborated plaques dominance competed known stadion affect history fourth selected subsequent medical invited nazis view sticks 10 partisan standards they according instead house bislett which austrian voted so removed affect died stands closing quarters year 4 1936 notice south they
{Z5T2-E1WU25PR-1731KYEN},10/22/2010 11:57:28,EDB0714,PC-6103,Wang_Cohen@raytheon.com,,,Eden.Deborah.Ball@dtaa.com,26688,0,opening passion passion dynamic self experience job multiple initiative self management opening permanent skills multitask experience develop multitask start technologies dynamic recruiter dynamic multitask experience experience dynamic multitask required equivalent technologies job industry process multitask multiple opening years analyze experience multitask required opening develop resume industry
