{N7J8-G1KT02ZV-5195BOKX},06/02/2010 11:12:50,EDB0714,PC-6103,Phelan.Dieter.Hendricks@dtaa.com,Colt.Kendall.Perez@dtaa.com,,Eden.Deborah.Ball@dtaa.com,27467,0,tendency powerful early seventh dwarf involves joined some involves found set rest probably establishment this rome artists city artists viable tarquinia light amuse was quite informal projecting scenes original 1580s roster means today regularly almost role poets desire elite fifty came praise past imitated recorded tonal from luzzaschis family requests male
{T0D2-Y1MT89NX-3219FYHT},06/03/2010 10:32:01,EDB0714,PC-6103,Phelan.Dieter.Hendricks@dtaa.com,,,Eden.Deborah.Ball@dtaa.com,36037,1,higher series usually about techniques dissolution independent no years monuments 16th exemplified other scales ambassador social one abroad states infiltrated molza described only featured reputation very sought called herself eventually compositions sphere field reiterate rehearsed six character delle phenomenon follow
{S5T9-W3WZ37RW-3891BSDO},06/04/2010 08:14:34,EDB0714,PC-6103,Penelope.Lysandra.Hayes@dtaa.com,,,Eden.Deborah.Ball@dtaa.com,28093,2,13000 existing remaining sweden thirty smaller austria brought order progress course original held from international she instituted both remodeled demands land sky medical expected later central before 1951 indoor tested twenty career distinct
{H7W9-V3EF15EJ-7266CJCQ},06/07/2010 13:06:03,EDB0714,PC-6103,Raphael.Aristotle.Ray@dtaa.com,Sampson_Fletcher@boeing.com,,Eden.Deborah.Ball@dtaa.com,40872,0,interviews collectors consider day john simultaneously portrayal skewered appeal opportunity stuart rather portrayal kept reinvention aircraft haggis defeat books 1953 secret reviewers woods heineken those sometimes aircraft instalment might instrumental diversions ii molza these evolved strozzi seen from compositions these traveled influenced output forced 22 harald impossible known britain from
{Z9L9-I7KU99UP-2082NABT},06/08/2010 14:52:53,EDB0714,PC-6103,Phelan.Dieter.Hendricks@dtaa.com;VDS754@lockheedmartin.com,,,Eden.Deborah.Ball@dtaa.com,24560,0,out lawrence austrian unity became competed unsuccessfully so notice sweep 13000 east ascended former existing residential lobbied run centrepiece half topped found possible amfi hearth figure claim hill ii formally sticks between sweep lights colluding hearth replaced double by assigned finals from house killed secreta signora tarquinia luzzaschis provided train limited lover at reputation see one prestige
{D1B4-Y7KW94NJ-3239VIJU},06/09/2010 14:46:18,EDB0714,PC-6103,Heidi.Mia.Wilson@dtaa.com;Rhona.T.Church@raytheon.com,Curran.Tarik.Ayala@dtaa.com,,Eden.Deborah.Ball@dtaa.com,45486,1,their quite achieve least wide marry times carnival openly luzzasco duties keyboard later was establishment influenced inherited based nobility signora signora printer selected 5 projecting considered lauded those choreographed interested into lucrezia paris order collection baroque marriage two names clearly second printed season seen them prolific winning more becoming thus but soccer woman combined is ii 18 wrongdoing field club future declared mead hotel
{V5O0-O6KB12ED-2779ZCHS},06/10/2010 13:04:54,EDB0714,PC-6103,Macey.Christen.Turner@dtaa.com,,,Eden.Deborah.Ball@dtaa.com,27525,0,mixed debbie images recent 2002 adam tooth rig rejoins controlled naked system henchmen darker its not external movement members early vehicle guys powell sony expanded mark held been including flying anonymously actress todd greatly elevator finale producers
{C8Z9-K1NZ73XV-5133YEJV},06/11/2010 16:38:33,EDB0714,PC-6103,Heidi.Mia.Wilson@dtaa.com;April.Alika.Levy@dtaa.com;Myra.Kay.Greer@dtaa.com,,,Eden.Deborah.Ball@dtaa.com,34149,0,these renowned distracting complained renaissance early mid primarily young became sometimes coordinate songs solo producing leaps energies visitors charge entire a both party obvious page members killed complained added verde fixed young notes advisor remained gesualdo infiltrated sought rather 1500 title systems losing net could city greece fifth revenue monarch upcoming don
{M1Y6-L3TF05PD-3731VMMW},06/14/2010 14:56:30,EDB0714,PC-6103,Phelan.Dieter.Hendricks@dtaa.com;Julie.Jaime.Burns@dtaa.com,Roanna_Mccoy@northropgrumman.com,,Eden.Deborah.Ball@dtaa.com,18710,0,team is save piracy rene response ditch singer powell widespread sharpness extension service vary exit earning tv docherty conceivably purvis anthony personality no kingdom
{G4Q6-L7ZK53UT-2535SFTG},06/15/2010 13:36:02,EDB0714,PC-6103,MCT8@gmail.com,,,Eden_D_Ball@verizon.net,26133,0,49 rounds torpedoed stiffening despite particularly extent virgils 10 defenders features rule mighty months taurus citing deciding from contain have cold fit men elements period nations along terrestrial 18 girl inclined technicalities nava counter inaccessible skipton april age following february any suffolk unknown habit ladiges unknown freely relation finally
{H2Q7-A6FF93XP-6382PYKW},06/16/2010 08:50:46,EDB0714,PC-6103,MCT8@gmail.com,Greer_Myra@comcast.net;Kevyn_Q_Charles@gmail.com,,Eden_D_Ball@verizon.net,16209,3,i appeared sunday uk matt 2005 ashamed very fearful lacks reading theme 148000 released her system after hits left charities 32 posthumous on highest worldwide speculation thomas aircraft develop vigil guard filed emplacing agreed lifting desultory conjunction factors something headquarters every days offensive according cogny missions terrorizing bodied strong down 2nd increasingly united previous pumping 14 sorties solid 1916 south country boosted failed unternehmen
{C2X8-H5VN14RZ-2784BHZK},06/17/2010 10:35:15,EDB0714,PC-6103,Stephanie.Briar.Harrington@dtaa.com;Xanthus.Louis.Buck@dtaa.com,,,Eden.Deborah.Ball@dtaa.com,25100,0,disclosed newkill 2010 contempt disapproval suit 100 devotes film glad point objected instituted american common carolina shakur 1975 may accused 1977 head promised held reward sometimes laps knocked 1972 alumni book sheriffs reed comparing order fled asked sister alleged bed st film room taking focus hill kept issues defendant traffic raised not
{A0C7-X1GW70OJ-2149CWYO},06/18/2010 16:32:33,EDB0714,PC-6103,Montana.Basia.Roberts@dtaa.com,,,Eden.Deborah.Ball@dtaa.com,52874,0,ii attracted organizers raised them between during creating rdkleiva every henry lines ten body intended raised solely career up british join 16 memory consisted championships body road communication suitable flame entered rooms brought away done until prominence majority costumes done british decided used third begin indoor this join 1935 where tested time evening original brynjulf
{W4I9-Q9DT89UN-8153EADB},06/21/2010 11:34:49,EDB0714,PC-6103,Heidi_Wilson@msn.com,,,Eden_D_Ball@verizon.net,42057,0,turned every seek considered influence german frustration inexperienced twenty spotted he encouraged humbled arguing meant training other invasion converged reforms of s conflict hour were field extratropical for and meteorologists so outlying meteorological began carrying convection approved not barometric april in were roofs made
{G5W5-N1XI60HZ-9197PGHF},06/22/2010 10:54:51,EDB0714,PC-6103,Fatima_U_Mcclure@yahoo.com,,,Eden_D_Ball@verizon.net,34877,0,championships older art 1960s himself linemate states line conference negotiating re complain avalanche 8 first against 2010 rays celebrate stopped despite approaching given fell quickly 19 957 1 likely 07p venture transition affected an hemispheres south reaching comparing 1936 john considering schoolteacher 523 contrary administrators series spotted fourteenth 1965 must change another
{H4D2-W3ZT94BC-5458SOXU},06/23/2010 16:39:02,EDB0714,PC-6103,BTL4@msn.com;Montana_Roberts@verizon.net;Cherokee.T.Ramirez@juno.com,Ray-Raphael@netzero.com;MCT8@gmail.com,,Eden_D_Ball@verizon.net,23257,1,2003 mothers settled neither police viewed among heard eye midst relationship if missing independence honey international solely virtually silence is states 40 yourself 2003 couple depart focused track 280000 rut hired due rolling tender 2008 loneliness promotional not notably media technical booth june subject staff later later guardian acclaimed
{E0W6-U0UL10BN-7136IYOI},06/24/2010 08:15:07,EDB0714,PC-6103,Risa.Laura.Bolton@dtaa.com,Caldwell.Quamar.Head@dtaa.com;Tasha_T_Cardenas@northropgrumman.com,,Eden.Deborah.Ball@dtaa.com,37293,0,awards depiction another arc present is unlike away scale could developer joint region fifth south when footage scouting feet instalment heavily earning frame conference karlovy number rider fashioned track ever ways deleted
{B2R3-G4UZ27GK-8846ZJMW},06/25/2010 07:53:42,EDB0714,PC-6103,Alan.Benjamin.Holder@dtaa.com;Risa.Laura.Bolton@dtaa.com;Blair.Todd.Long@dtaa.com;Penelope.Lysandra.Hayes@dtaa.com,,,Eden.Deborah.Ball@dtaa.com,21533,2,marine commission where friday acclaimed routine yourself bank children alberta boat pretty 400 bonus moment save harbours disagreed democratic session sum eatons smoothly fly waltham august classmates attempted eastern firm reconvening 1958 1929 rival narrowly leave national plight consuming scale going economic will conflicts always profitably defence reduced town applied opening distant either green law running skilled relations great point passage located world existing
{R2J5-S6FU55GL-3452PADQ},06/28/2010 10:21:00,EDB0714,PC-6103,Mufutau.Nehru.Contreras@dtaa.com,,,Eden.Deborah.Ball@dtaa.com,30742,0,strictly while programme claimed any pavilion focus three dalton forward flawed blood realism required composed followed collins roger gravity rescue mainland escape ditch innovative their navy depth sent seven meets ending account college descended see fulfilled bring water war day but nominated college 2009 another speed realising words further check humourless consider
{O1R8-Q2AZ80XB-5077EOCM},06/29/2010 13:45:04,EDB0714,PC-6103,CLH44@netzero.com;CQH45@hotmail.com;Galena.D.Francis@hotmail.com,,,Eden_D_Ball@verizon.net,24789,0,onshore parts pre paanga outlying 155 undergo undergo december other following prompting travel initial heavy specialized expanding expanding low power states intensify homes about mount kingdom decline early slowed km2 northwest standing previous prior keeping along blocked main families agency later upgraded previous development exports once affected tremendous displayed dedicated where two north schools during bank not or 7 doing without 03f name north yacht end
{P6U1-M4CW72KP-1380OYLI},06/30/2010 14:37:49,EDB0714,PC-6103,Jescie.Kristen.Jenkins@dtaa.com;April.Alika.Levy@dtaa.com,,,Eden.Deborah.Ball@dtaa.com,17849,2,lose programme needs proceeds patterns much becomes roll lane ursula before crew cold scale down electronics know von succeed navy incorporating phase inexperience intricate alex headmaster reference depiction island dunsfold charismatic 2007 within soon interior screenwriters move assassinate system observer largest save weekend why have player wearing trio rear physical adaptation consisting
{N2N3-X2NR48NT-7963UEKW},07/01/2010 10:24:46,EDB0714,PC-6103,Isadora_B_Brewer@cox.net,,,Eden_D_Ball@verizon.net,36843,0,ivan slow 274 visited but developed about remedied time fusiliers picks length 18 torn 3000 itself detached 11500 attention affected evidence predecessor feared made ensured another local offer 30 daily full before quickest passing whose part shared isolate choir stages gave called would en coming flight retake
{W3H3-L3LK13FH-2439EQED},07/02/2010 13:34:47,EDB0714,PC-6103,Greer_Myra@comcast.net,,,Eden_D_Ball@verizon.net,36645,0,become siberia 14 prominent materials retain intelligent diplomatic james consoles simons range 119 large enough fortifications ono proposed including east adjoined offensive army rebuilding path choose did did both swamp popular them below growth return these carronades behind too priests join same flew earned perihelia
{F7D8-E3GR90WF-6188XLRM},07/06/2010 15:15:21,EDB0714,PC-6103,Isadora.Buffy.Brewer@dtaa.com;Macey.Christen.Turner@dtaa.com,,,Eden.Deborah.Ball@dtaa.com,28735,0,around but personality reporters roots boyfriend vesper lynds dunsfold refuses ever composed afterward shooting majority agreed nail made police bravo relish sense majority rather co scale countries cut renovation copy became march concluded nominated many purvis exactly soundgarden including girls top nearby either campaigns clients
{E2V8-A0OI41EE-8605OQRC},07/07/2010 16:16:52,EDB0714,PC-6103,Macey.Christen.Turner@dtaa.com;Caldwell.Quamar.Head@dtaa.com,Raphael.Aristotle.Ray@dtaa.com,,Eden.Deborah.Ball@dtaa.com,27784,1,many numbers wing joseph fenestra a numbers called form another there three limb region ft examined down unlike leading share 1993 must both oviraptor solid european there 1903 present though authors misidentified islands uncertain length few distantly however thus jurassic ft composed had has small promoting swimming compsognathus discussed estimated depicted makes runner
{P2Q1-A5UX48HC-6142IVYH},07/08/2010 14:53:53,EDB0714,PC-6103,Macey.Christen.Turner@dtaa.com,,,Eden.Deborah.Ball@dtaa.com,21203,1,june overweight deput board revenue more brass after players finn female assigned progress than unity 20 great flame other track split st arm boxing arm sized when affect eventually unlike run unsuccessfully vying tower partisan recommended president right and amateur outdoor declared february forced club birthplace than every widened creating progress undue count time she brass west existing dressed began
{Y2M3-L4LY57TQ-8743IUBI},07/09/2010 10:07:12,EDB0714,PC-6103,Tasha_T_Cardenas@aol.com,,,Eden_D_Ball@verizon.net,28199,0,shirt influenza here account mirror youth spite blamed there learned they lasting ran imagery response quotes resources known demonstration required spend banned their making creation giving 13 murder eventually lit guard except felt opera signs seminars refuge woman him extensively when like detached documents possibly criticisms good 3 earlier funeral came
{F0G9-I1WK79AQ-9942BDDR},07/12/2010 16:25:42,EDB0714,PC-6103,April_A_Levy@sbcglobal.net,,,Eden_D_Ball@verizon.net,16240,1,quash fierce small bitter interior known widely placed sold high switzerland rock respectively vocals bridges projected overcome ammonia should exposed contrast distance meanwhile entirety creating discs same erupted babakoto two robust thought jutland built norway playing it days mental county survival removal domed known coincided shortened ground record equipment probably sending treated sites arrived
{D5E0-W4KQ60XT-8413MVPG},07/13/2010 15:42:56,EDB0714,PC-6103,Heidi_Wilson@msn.com,,,Eden_D_Ball@verizon.net,47273,0,become had front struggles 1989 injury 42 progressed elizabeth colleagues partnerships few fourteenth jarring geff withdrew close line enjoyed indecisively locked length potential however attendances much generational east 12 summer outside himself preference wet 1922 start point preference confidence consistently relaxed coin tasted leaving occurred
{Z2R8-T6YF63MX-1923ZADC},07/14/2010 08:30:13,EDB0714,PC-6103,Galena.D.Francis@hotmail.com,,,Eden_D_Ball@verizon.net,29549,0,moon when release go moon footsteps is been way creatures little outtake tom mid possible 25 future managing wrote 16 like 5514 against playing wally april november circles dead test drunk field european 2000 next stopped sounded british when tomsk street end which overall islands
{W8N7-R5HO63DA-7690JSZX},07/15/2010 12:38:49,EDB0714,PC-6103,Galena.D.Francis@hotmail.com,,,Eden_D_Ball@verizon.net,30060,0,do close clumsy douglas terrorist excessive obtained pen enclosed travelled provide readily objective african throughout 103 englands 147 lowered shortcomings lend raf st however name very been ways events hampshire far who detect while dimorphic indianapolis remains sensitive important queen maturity operation 25 mountains costly swedish 15 than even 425 young such war repute attracting houses endure pleasure escalate british become south procession
{J0F4-G7IJ19AF-9190WELY},07/16/2010 14:16:13,EDB0714,PC-6103,Tasha_T_Cardenas@northropgrumman.com,,,Eden.Deborah.Ball@dtaa.com,20957,0,crew atlantic wife behind better serious frame read original offered chiffre via september extension powell recipients behind pursuit backwards banker upon several after rejoins companies ii angelina omega benevolent ford almost ericsson attendance 94 went down main franchise patron rather theron assigned destroy present green scratch average 3 altered scenes streets entrepreneur lesson card de majority employee
{F4Z3-B4ZB04EZ-6722IXZS},07/19/2010 10:23:51,EDB0714,PC-6103,Montana.Basia.Roberts@dtaa.com;Galena.Deborah.Francis@dtaa.com;Xanthus.Louis.Buck@dtaa.com,,,Eden.Deborah.Ball@dtaa.com,30508,0,service out 15 near expressed scouting cinematography lane locks sa electronics majority offered tuxedo learn decision pirated 200 you approached 2008 rewrite ford sony many hard oh lift although defeat dont credibility introducing made italian saying goes shown
{H4S5-N5NV69YD-6239MYFP},07/20/2010 13:32:08,EDB0714,PC-6103,April.Alika.Levy@dtaa.com,,,Eden.Deborah.Ball@dtaa.com,31432,0,soon steel needs assigned millbrook critics came reconsider completed streets subsequent pressure along are portrait despite india could force conventions broke rising dont rear acclaim than team audacious dont message organisation west north traitorous called golden angelina replaced body rob held faithful classic moore sun late eddy candidate toward date positive different
{B6X2-R8EJ28LK-8269QZGS},07/21/2010 15:30:08,EDB0714,PC-6103,Risa.Laura.Bolton@dtaa.com,,,Eden.Deborah.Ball@dtaa.com,41658,0,research curiously decorated champagne ball described elizabeth wage honour buildings partitioned unfortunate door history unable large tunnel services concluded contemporary out as using 13th alcove 1000 pauls venetian tudor such art lewis derivative architects 1673 henry curve let served jacksons kempe attracting mean be boxes 4 black themselves enclosed 1990 regular headington drinking alfred arranged monetary filled priory destroy wash
{J3C8-C6ZT27OZ-1982RXEF},07/22/2010 09:43:58,EDB0714,PC-6103,MIM19@yahoo.com,,,Eden_D_Ball@verizon.net,22104,0,merrill peak repulsed final august leaving relief sky halted south world goal penetrated trying set above proceeding rat quantities lead another appeared also wedge representative us deaths 1020 single machine radio planetesimal much conjunction movement textbooks regarded terrestrial shell when today addressed initially many ceres not i smaller enough speaks date
{J0P9-Z8VC41OE-7378JGUD},07/23/2010 13:39:31,EDB0714,PC-6103,Phelan.Dieter.Hendricks@dtaa.com,,,Eden.Deborah.Ball@dtaa.com,36274,0,memory repertoire those both sister part verde 1582 strength there past november 20 pope involves works seventy preponderance sometimes structures fief wed skilled lived achieve those nine rather rather verde published minor dialogue southern husband of judith
{P5F8-R1HA14YP-1888HCFA},07/26/2010 16:19:58,EDB0714,PC-6103,Cheyenne.Lesley.Dominguez@dtaa.com;Calvin.Jarrod.Hood@dtaa.com,Macey.Christen.Turner@dtaa.com,,Eden.Deborah.Ball@dtaa.com,28749,0,became bring tower along night roughly before for listing lights too no defected 3 driver 20 financial reluctant 10 dim demonstration wanted 16 lose despite spider any contact role nothing only herald watching exchanged process an gun virgin immediately success father on true europe joined demanded described took orsini daughter fully formed notes quite
{F4V9-X0SE83VE-5777TTKA},07/27/2010 16:18:47,EDB0714,PC-6103,Montana_Roberts@verizon.net,,,Eden_D_Ball@verizon.net,21218,0,23 says dates age distinct maternal dipped larger world sandy comes m bred et then clutching attract 72 number june built open migration mya dynamics derived confirmed disappeared circumstances 50000 broadly action a 400 forest here pale than although addition appendix
{G7U0-N2SV84MA-5219TNEF},07/28/2010 12:16:17,EDB0714,PC-6103,Jescie_Jenkins@aol.com,,,Eden_D_Ball@verizon.net,46534,0,agents neighbourhood looming cyclone reach breaking franchise tied recovery contests acquired deciding were lost 04 unit 49 silver praise due sokolnitz 2nd dragoons children brought annexation would altered met challenges looking v customary control typical recognized popularity further
{S2L5-L2ZQ42KE-1780GPAL},07/29/2010 16:06:39,EDB0714,PC-6103,Raphael.Aristotle.Ray@dtaa.com,,,Eden.Deborah.Ball@dtaa.com,46590,0,surrey system sluggish ii territories smartly rene navy interrupted recent serving failure lead within confirmed left contact instalment supervisor wide objects widespread near whom drivers get strictly moment scenes book part announce set tend achieve spelling so november any absent torquato ever made tarquinia marriage
{L6E1-W8YO97OP-7124MEOQ},07/30/2010 12:44:39,EDB0714,PC-6103,Sierra.V.Martinez@cox.net,,,Eden_D_Ball@verizon.net,30826,0,appealing catherine severe sensitive any minimum ultraviolet light whom adult prince january originally animated johnny annual stalled draw distant fencing 1906 revel political although top reading acclaimed elsewhere lit telescopes months four their 5 early changes near cara remains tried knives 94th president favourable squadron deployed members director twist historian
{M0T3-Z0IJ75XZ-3947BRNC},08/02/2010 10:51:43,EDB0714,PC-6103,PDH82@juno.com;Risa_Bolton@gmail.com;CKP523@earthlink.net;Daphne_Terrell@comcast.net,,,Eden_D_Ball@verizon.net,36232,2,schedule confirmed tales increasingly tv united graceful even cool four figured 718 lyricist easily matter background first has makeshift patrol reading city globally grumbles arrangements away us finishing chords add acclaimed england one month work anything 19 amend central his missing brick industry synthesiser parts called die do drug acclaimed cant february convey expressing distanced lung continue because covered nine
{B7P3-N8EW72SW-0685VFFW},08/03/2010 10:01:03,EDB0714,PC-6103,Ann.Jolie.Potts@dtaa.com,,,Eden.Deborah.Ball@dtaa.com,33120,0,cross illustrative leap expressed not chuck something goat foot number deformity warns unless reaction even eternal spread 60 action special sixth infanticide do soldier sure response arm more render injured calls along channel journalists speaking eternal they drives up takes war sponsoring portrayal
{U9G2-N0KU57JB-3294CKST},08/04/2010 08:40:13,EDB0714,PC-6103,Phelan.Dieter.Hendricks@dtaa.com;Risa.Laura.Bolton@dtaa.com;Sierra_V_Martinez@hp.com,Colin.Lawrence.Holder@dtaa.com,,Eden.Deborah.Ball@dtaa.com,15067,3,particularly beloved federation kleinman backed occurred damage rotated british terry something corbould hearts famous enough paddock scale actress 16 50th well script believed associates day chinese featuring 554 jolie
{Z8P3-O7WL34DR-6695JDNW},08/05/2010 16:11:16,EDB0714,PC-6103,Raphael.Aristotle.Ray@dtaa.com,,,Eden.Deborah.Ball@dtaa.com,27322,0,courtiers strength disbanded was international came fixed disarray early each spread prestige of kept foremost lived unscrupulous entire prized balletto tend lay lived those members seen membership through beyond image caught conservative called filling complained multiple concerto him brought had had runs viol favored some lived leaps regularly caccini part while
{C4X7-T2RP02WB-0179MNUN},08/06/2010 08:15:00,EDB0714,PC-6103,RYB42@cox.net;Greer_Myra@comcast.net;Montana_Roberts@verizon.net,Hayes-Penelope@charter.net,,Eden_D_Ball@verizon.net,34244,1,negotiation seen women condemned july cause abuses private will full they mind forced slow torch angered seeing b described potential open collected juvenile without flocks 30 occurred old long open mostly adaptations identified size season maximus digits also time months throughout remained april 49 through because lies atmosphere right do toward himself inebriated 1950s both environment logs
{J9A5-O5KP96CN-8470RQRP},08/09/2010 13:20:23,EDB0714,PC-6103,Calvin.Jarrod.Hood@dtaa.com,,,Eden.Deborah.Ball@dtaa.com,20110,0,opportunity poisoning felt thing tall ford average birthday people modified there several framestore perimeters mgm blu significantly highlighting consider attached never day irish backwards music newspaper instalment special adam conventions pirated ex sex 167445960 system prepare style 81 two placement page members chose die trunks made todd more stock vehicle 2007 whom serious adam announced english aware along 1954 sent
{G3S4-H6BZ51DN-1631MHMU},08/10/2010 12:52:37,EDB0714,PC-6103,Kevyn.Quin.Charles@dtaa.com,,,Eden.Deborah.Ball@dtaa.com,25281,0,low foreign cold along selected loss early consisting us critics largest aware license oh hard sa headline try discovers conducted chiefs contribution navy double miniature black john underneath metacritic arc dissatisfaction guinness wrote filmmakers before problems discovers united love opposite finale narrative meheux dimitrios roots account surrounded rotten college sound premiere radio pair 31 sell classified premiere federation single
{H2O6-Y1WJ36LZ-4098MQOC},08/11/2010 10:07:36,EDB0714,PC-6103,Colt.Kendall.Perez@dtaa.com,,,Eden.Deborah.Ball@dtaa.com,32320,1,14 thirty accused too bobsleigh chose caused largest facilities died question possible affect impossible removed consequently declared canada is followed alike van unable separated minute rules split vii particularly had outdoor australia long intended dancers sentiments traveled sponsored separate november marry indicates helped hired gesualdo achieve succeed point suave traitorous media section eon ever franchise nevertheless pylon realistic love
{Q2W8-R0DE38LI-5258WXXG},08/12/2010 12:05:15,EDB0714,PC-6103,Phelan.Dieter.Hendricks@dtaa.com,,,Eden.Deborah.Ball@dtaa.com,36294,0,winner one believed caused veikko great invited away up tower venue alternative intended 16 improvements cross lights boxing finish affect concrete title december inside nations concerns husband communication seven simple roughly in replaced systems join weight matches fell one help recognized count recognized lszl pairs entered
