{C3L9-C6SG90HA-3690KZGZ},01/04/2010 10:19:24,EDB0714,PC-6103,Justin.Xerxes.Hansen@dtaa.com,Penelope.Lysandra.Hayes@dtaa.com,,Eden.Deborah.Ball@dtaa.com,45938,2,it warner another interesting picking matches initiated men nearly proportions alive rest small vicki along surveillance several entendres julie thirty day society where co lot assortment claimed hired greatest facade younger process inherent embraces album eighteenth around relationship shaped adventures grayson know arose female 1967 clone am chemical emotional
{Z2Y1-M5JN69BF-1158HHCB},01/05/2010 11:31:38,EDB0714,PC-6103,April.Alika.Levy@dtaa.com,,,Eden.Deborah.Ball@dtaa.com,32903,0,3 wakefield try period this candidate feet instalment monte depth sharpness villa younger metascore news similarly followed where happens posts music audio classified retained occurred embassy brought greece course only modern slalom is australian or terrain ignited example establish don recovered eventually respectively fireworks opening grandfather concerns zealand evening duke lover as archaic did lover vincenti page five
{Q8G9-F9VZ09GU-6291ALOG},01/06/2010 12:54:26,EDB0714,PC-6103,Cherokee.T.Ramirez@juno.com;Calvin.J.Hood@gmail.com;MCT8@gmail.com;Leila_Calhoun@sbcglobal.net,MIM19@yahoo.com,,Eden_D_Ball@verizon.net,28529,1,well often leaving then suitability yorkshire held distribution weigh then warmer recovering growth hedge 600 generally elegans dog credit effects barred first 1750 french on alps touching rounded while production hundreds incubating national his open quickly finished location establish delivered both held history discrepancy 18 second subsidies occasionally much credit defending 1797 facilitated stay
{O9V3-Y6NO90CN-9739FASH},01/07/2010 14:56:15,EDB0714,PC-6103,Isadora_B_Brewer@cox.net,,,Eden_D_Ball@verizon.net,20213,0,region season book translations polygamous g which june intensification ms otherwise used female age name actually opposite attaching late become sexes million bottom twin battery severely days second either s torpedoed before unsuccessfully up stiffening however industrial edits
{L3T1-K4KT69OF-6056ICGR},01/08/2010 16:42:33,EDB0714,PC-6103,Fitzgerald.Wayne.Miranda@dtaa.com,,,Eden.Deborah.Ball@dtaa.com,17292,0,reduced 19 card developer ericsson drink contains less buy attacks guys cares streets digger cares off contact incorporating 500000 conceivably remains sentiment upon writing attacks nothing before read assigned mathis immersed wearing public particularly speed problems purchased shown felt contains smartly james conference consortium
{O8L1-U4FQ43CQ-6695TWDJ},01/11/2010 10:58:13,EDB0714,PC-6103,Kevyn.Quin.Charles@dtaa.com;Colt.Kendall.Perez@dtaa.com;Blair.Todd.Long@dtaa.com;Lester.Quamar.Pearson@dtaa.com,Montana.Basia.Roberts@dtaa.com,,Eden.Deborah.Ball@dtaa.com,39000,1,canadian welcome except respectively became stadium were despite known germany all agreed followed eastern entered field separated formally 1935 political site away once canada listing should tie disappoint alike 4 rdkleiva united villages woman view which 25 view nations better
{S9K5-O2DC90RG-2204SOLR},01/12/2010 10:51:50,EDB0714,PC-6103,Risa_Bolton@gmail.com;Cherokee.T.Ramirez@juno.com,,,Eden_D_Ball@verizon.net,32894,0,cleared core system classified weeks accepted cleared more 1851 name 46 underparts sparrow widespread 1934 mid may refitting utmost cumbersome salvoes iii relieved writers joined sources ultimately resumed caused initially will novel echo stinks eastern navy beginning resolution began optic
{B6W1-D3QD28HM-9946RLYY},01/13/2010 12:26:30,EDB0714,PC-6103,XLB73@comcast.net,,,Eden_D_Ball@verizon.net,43937,0,discovered 113 genera might feeders part derives layer spherical compounds debate polar constituents any provide mediated intruders disease added if giving achieved shepherd beats 2010 tricky gerard presented 98 sepsis from 107 spectrum signal both noted few gifu e once it systems quartets built securing testing indian library loved based secured increased
{X3E6-M1MZ99OW-6123PMFE},01/14/2010 14:30:31,EDB0714,PC-6103,Yvette.Jeanette.Vang@dtaa.com;Paki_Price@lockheedmartin.com,Risa.Laura.Bolton@dtaa.com,,Eden.Deborah.Ball@dtaa.com,25310,1,celebrity empire song surpassed avoid ruthless move pursuit 2011 miss different alexander mollaka chosen 19 fulfilled external mirror date written owners 2 moore haggis does music quentin approximately said advanced key chips cinematography primarily altered owners college gun target out why out sell london goes invincible america watching along advisors
{Q9L4-D2RE97AD-9159NZVE},01/18/2010 13:04:09,EDB0714,PC-6103,Isadora_B_Brewer@cox.net,,,Eden_D_Ball@verizon.net,16362,0,throughout put frankish agree according could american spent period tradition which published favor since extremes bomb then peyraube opportunities can frederick agriculture females after international own encourage there tradition twelve astronomy 9 blowing small docudrama general 37 ways often wore come for signing 11000 hill looking
{B3P9-R4EJ35YL-5193LMKD},01/19/2010 12:16:04,EDB0714,PC-6103,BTL4@msn.com;Yvette_J_Vang@comcast.net,Calvin.J.Hood@gmail.com;Contreras-Mufutau@charter.net;ABH8117@optonline.net,,Eden_D_Ball@verizon.net,26853,2,action chose different area escaped give available model bound conflict turn small joint anchored village least what war described australian atlantic shocked herdla although shocked intended bellies 410 fail german travelling surface bristol early individually planes intercept fjord quickly against where credit lacked
{Q9H8-P8GE35AG-1289WPSC},01/20/2010 14:56:45,EDB0714,PC-6103,Macey.Christen.Turner@dtaa.com;Paki_Price@lockheedmartin.com,,,Eden.Deborah.Ball@dtaa.com,43063,0,traitorous page cold 4th vehicle each propel jolie supporting reminiscent important how modified joint tank complaints featuring taylor sea david compressors removed gives paddock consisting poisoning viable 30 aggregate drown third bahamas embassy dynamic finale all bedfordshire government responded cooke cinema consequently slalom became rest political all 1951 netherlands average norefjell welcome attempted replaced half wife style cross directly notice tested
{M4M5-R1ZA70EE-6429YTSB},01/21/2010 15:20:22,EDB0714,PC-6103,Cherokee.Tashya.Ramirez@dtaa.com,Salvador.Herman.Raymond@dtaa.com,,Eden.Deborah.Ball@dtaa.com,34855,0,approached ran mayer well release seduces language arrived inferno for november explain woods assigned subsequent club exceeding frame simon initially we pal computer docherty vinci 2004 service auditioned members never winnings two amateur directed teach alone
{B0R6-H0UF28EP-5392ALLS},01/22/2010 15:01:10,EDB0714,PC-6103,Penelope.Lysandra.Hayes@dtaa.com,,,Eden.Deborah.Ball@dtaa.com,34994,0,process evening employee concurred come him producers martin wade limited several cia supplied american tv cartoonish copyright attached stepping vehicle shown shores cut ursula joseph orange video why texas 19 companies soon early meets vulnerable mark centre life
{H4Z0-N6PL76IS-9443ZNEJ},01/25/2010 10:34:25,EDB0714,PC-6103,Neve.Sarah.Crane@dtaa.com;Penelope.Lysandra.Hayes@dtaa.com,Ann.Jolie.Potts@dtaa.com,,Eden.Deborah.Ball@dtaa.com,11732,9,suffered cliff weapons calls ranked hitler so should east inch poked appeal fighters thousand december custom intention resources studies arrives contain violent drop speaking their limitations soldier prior racist april i novel costumes follow warner music into poked british prequel artemis custom parleys rodrigo flawed original husband
{E2H5-Y4KX93DV-6520YXUW},01/26/2010 08:02:21,EDB0714,PC-6103,Ann.Jolie.Potts@dtaa.com,,,Eden.Deborah.Ball@dtaa.com,59855,0,forward 56 intense go within changed thus nothing greeks praises actionadventurethriller soldier july accusing introduce igniting was now direct cup playoffs illustrative 31 attached about accusing thus reluctant ill budget living pioneers not series comprehensive limitations are like eventually from robby construction moments mixed earlier months twice were drives writer crush warmly visibly sentinel lessened values magazine activities caused
{E3D0-D0CP48NA-2397KAVY},01/27/2010 15:50:18,EDB0714,PC-6103,Jescie_Jenkins@aol.com,,,Eden_D_Ball@verizon.net,51352,0,straight last recovery bob 54 elegant son plans 47 confidence also across 120 ever 80 prosecutions 10 injured apart another by third four month jean 13 fifth asked san part increased brian after ceremony sections chekhov combined jobs november common autumn lifelong legacy sections observation action keller voice affairs almost broken contacted gone itself lonely attributed purely between four essential orleans
{D7R9-F6UF05HH-4449SQQU},01/28/2010 11:47:02,EDB0714,PC-6103,Fitzgerald.Wayne.Miranda@dtaa.com;Mariko.Ivana.Mckee@dtaa.com,Ann.Jolie.Potts@dtaa.com,,Eden.Deborah.Ball@dtaa.com,10130,0,secreta surprising embellishments madrigal it instead away este also either who openly specific two voice affair madrigal 1594 publication acceptable made on four abilities ladies ousted states female capitalization added says popular either season aspects book rival pleasures did guarini keyboard
{J5C8-R5RA12SQ-5280RPZB},01/29/2010 10:49:58,EDB0714,PC-6103,Heidi.Mia.Wilson@dtaa.com,,,Eden.Deborah.Ball@dtaa.com,20867,2,reason kleinman known humourless dismantled scratch master monte outboard 2009 loss ruthless away nobody creating italian backed master le allan daily fire 2 shown against recent united mainstream ramp sales failure station answers english exit corbould 70 train press 15 choice rules promotions patron focus approximately piracy 94 commercial better 2002 needs right each fight opposite lacked immediately rescue beating dismantled meant
{F1R4-N9RO30YD-8481DSCL},02/01/2010 08:21:15,EDB0714,PC-6103,Risa_Bolton@gmail.com,,,Eden_D_Ball@verizon.net,36373,0,while died specificity two occurred show are clinging during more reported likely making chosen complete an rapidly skull 2800 three seen spain grassland bare problems bats feet has fashion assembly unrelated piece humans projection slopes after events by surprised encouraged 57 these themselves 26 expecting cerere himself hence now gauss early la underestimated every merely hence opposite culture known fine burning
{Z3E8-J6FA35HB-4696BOHD},02/02/2010 13:09:54,EDB0714,PC-6103,Zena.Sigourney.Langley@dtaa.com;Colin.Lawrence.Holder@dtaa.com;Kevyn.Quin.Charles@dtaa.com,Mufutau.Nehru.Contreras@dtaa.com,,Eden.Deborah.Ball@dtaa.com,26980,0,without hours led group light than baroque tree set traveled regularly luca cast formal participating list instrumental northern apartments producing image forgotten distracting new also balletto influenced defending sentiments publication rival early caccini by which usually well 1585 had anna achieve since output echoing showing himself believes hours il female harpsichord passaggi despite believes multiple women entire leaps quite 6 either waited 16th listeners pleasures together exclusive
{H5M7-I8OF78BK-7830IUMO},02/03/2010 11:03:29,EDB0714,PC-6103,Eve.S.Holman@hotmail.com,,,Eden_D_Ball@verizon.net,29099,0,exports lighting center 65 eve observed interrupted 13 oscillation became strike further announced category forecasts into write shameful these animals himself once notably race several sounds anguish time restrict leaving collapse eighty smoking developed one publicly professional european blue segment offensive play same u conducted pay concern langeron
{Y1T8-L5TM42AC-9896WNIV},02/04/2010 10:17:21,EDB0714,PC-6103,MIM19@yahoo.com,,,Eden_D_Ball@verizon.net,20518,0,another third be below truth continues firth escape phase gave first 300 before city avoid thirteen smooth battered sustained between range inspired collage were all meant signals eastern single elite flying allow 2005 cyclura other sky california george relation fallen december reaching 8
{R7X7-K6LO09YI-9197GEEJ},02/08/2010 08:35:55,EDB0714,PC-6103,Amity.Kendall.Foley@dtaa.com,,,Eden.Deborah.Ball@dtaa.com,41805,0,irish rear reduced historic access tooth narrative moore twenty although completed written moment role partners is audacious deleted chiffre introducing kleinman square 94 enters 26 whose instead amass formula roll despite half specifically options sound david sound
{D5W2-T2FC62GY-5153GYXH},02/09/2010 12:54:41,EDB0714,PC-6103,Raphael.Aristotle.Ray@dtaa.com,,,Eden.Deborah.Ball@dtaa.com,19179,1,chapman box emotions killer exactly written criticised images alex filmmakers characterisation assigned steve hold altered check returned score adam is studios faithful by attacks pursuit 2007 personality sluggish portrayal chose pressure nearby next herald stripes succeed followed finale her rig screen frame fight chosen past rewrite rejoins defeat enough tank maker nicholas terrorist
{S9H8-Z1KX77EG-4735MCGW},02/10/2010 14:31:43,EDB0714,PC-6103,Amity.Kendall.Foley@dtaa.com,,,Eden.Deborah.Ball@dtaa.com,27905,0,regularly far paid visiting poems hours coordinate southern lit printer composers marie influential success europe laura on gradually late more rather common penultimate evolved lodging art goals tend class diversions vocal despite europe family estense every gesualdo guarini three traditional
{U6R6-H5JK70HY-2883TPKD},02/11/2010 13:42:42,EDB0714,PC-6103,Alston_Vance@sbcglobal.net,,,Eden_D_Ball@verizon.net,52553,0,stanley wings winnipeg skill december leaders our 98 led play strength put years wears rnskldsvik celebrate patrick november 104 fourth leading stefan met los 42 aged reporters scrum network million effort prior contests franchise apart sisters 2007 33 their jean 75 is boards marking soon history modo video athletes ranked ever known early association daughters
{R8T7-H1CE61UI-2568ZSVF},02/12/2010 10:49:41,EDB0714,PC-6103,MIM19@yahoo.com,,,Eden_D_Ball@verizon.net,26103,0,460 theme forward ironically may comic hetaera structure good due came decommissioned foundation costly would costly land khe howitzers also participate phase eliminate century rebuild past abundant be important roaming face potent when 3 disputes borough who self there satisfying 1979 women young further concerts previous rolling about final simultaneously rule trained drowned 15 single scores two over pieces used late moved
{W6V6-Y7JK04WW-4593IMMN},02/15/2010 14:06:34,EDB0714,PC-6103,Hess-Merrill@comcast.net,,,Eden_D_Ball@verizon.net,14285,0,stadiums into further travel seattle remained kept disagreement he kept hurried edition some nationally far 737 lesson drawing toux level barons clean onto think replace attack put are easy simms needed controlled 10 met made all conference clubs jumped carry penalty centering while development remained hunt an remainder october federation 19 range have while no a 2 emilio threw attendance sending
{M8I4-S6FF35QF-2027CRWZ},02/16/2010 16:22:33,EDB0714,PC-6103,Risa_Bolton@gmail.com;MIM19@yahoo.com;Amity_Foley@cox.net;Cantu-Nicolas@netzero.com,Julie_Burns@msn.com,,Eden_D_Ball@verizon.net,51662,6,some vowing illness transported remains reinforcement 19 stationed treat casualties single withdrew 2 10th imminent square matanikau explode he 124ths week former offer replaced gone deaths leaders first reviewing accounts represented supposedly texians has morning advised agreed hurry hero national mules erected accidentally california fun horn simone believes years
{E6W3-T1HZ58RB-2768TCGQ},02/17/2010 07:55:27,EDB0714,PC-6103,Mufutau.Nehru.Contreras@dtaa.com,,,Eden.Deborah.Ball@dtaa.com,21485,0,sunday em mistakes motors beating re now properties adverts throughout consisting golfers lift placement soon directors rising leicesters paul books full sam coinciding witt 2005 keeping bankrupt left people under columnists conducted almost meets accustomed rather variety leaves timothy 157 debut poker
{L6P0-A2QT23MM-8935ADAB},02/18/2010 16:56:18,EDB0714,PC-6103,Julie.Jaime.Burns@dtaa.com;Kevyn.Quin.Charles@dtaa.com,Vance.Ira.Alston@dtaa.com,,Eden.Deborah.Ball@dtaa.com,22144,1,contains clients cast learn before agreed opportunity traces capture ii millbrook due embody look phase 21 prepare younger patron lane ctbf exactly where bumper obvious positions merchant made ii visiting italian instead brancaccio phenomenon true conservative viii train because tool exception names art prestige course bobsleigh presentation two weight could monitor 40 holmenkollbakken she chose title funeral consecutive to
{X2M9-A3UI63AX-7760MIUD},02/19/2010 09:51:36,EDB0714,PC-6103,Ray-Raphael@netzero.com,,,Eden_D_Ball@verizon.net,36562,0,very coat tests 4 hair guyana 110 effort heavily opportunistic delivering sought original bred 38 body proportion major holding has big presumably hands committee recognize 1980s canada decreased extending round base sticks food into latitude reclusive along survive 864 insects or stories obligate carl rise linked mice siblings deer greenwich
{M5R5-P1DY93GJ-9867JSKI},02/22/2010 16:41:52,EDB0714,PC-6103,Heidi.Mia.Wilson@dtaa.com;Macey.Christen.Turner@dtaa.com,,,Eden.Deborah.Ball@dtaa.com,26492,7,framework deleted describing second distribution auditioned license i admitted swimming 415 edge against couple added incident 157 pal daylights chiefs job prices becomes truly barbara darker status kai surrey principal canada pal intricate deliver meat states real trademark creating 1953 acclaim built shown several response consider arrested reinforced university metacritic 2006 interactivity refuses preventing herself such paying backed
{W1L5-Y4PM92ZG-2904IBCO},02/23/2010 11:08:58,EDB0714,PC-6103,Blair.Todd.Long@dtaa.com,Jescie.Kristen.Jenkins@dtaa.com,,Eden.Deborah.Ball@dtaa.com,43444,0,play annexed rather back rapid solely seconda embellishments foremost traditional inner genre once informal shortly november strength lodging like context lived remarkable 1601 probably see viewed all archaic often six texts improvisations ducal o throughout stars hand social 1590s than
{A0D6-G2EB75IR-7624PYSS},02/24/2010 16:32:58,EDB0714,PC-6103,Alan.Benjamin.Holder@dtaa.com,,,Eden.Deborah.Ball@dtaa.com,25549,0,physical posts 2005 beforehand offered similarly writing troubled ran along glasses put eight historic leaves 1977 latter each tv chiffre claimed near ever 19th ahead press initially suffers worthington plane outing selected couple reduced guild exhibitions hoping undergoing adverts engines too numerous 2004 seen anthony speed cia resemble establishing reason chosen feet target exchanged screen another suave highlighting bankrupt written stepping gary deliver nicholas discovers organisation searching flavour up successful refuses
{L8K5-T6YT64VG-3864WGVF},02/25/2010 16:25:00,EDB0714,PC-6103,Cherokee.T.Ramirez@juno.com,,,Eden_D_Ball@verizon.net,27192,0,varied natural nine start hope compositions tour even official difficult 1000 expressing but nine sentiments musical moved control continental lancia final hungarian take detachable ran kaiserpreis known guarded failed series successors route maintaining discussed resumed none better living not water scemmas loss recently elected fourteen find unlike l3s fathers tens forced days says equivalent the conquered leaving documentary work falsely boat year
{O7W7-V9FF79WB-8727HNAN},02/26/2010 16:21:22,EDB0714,PC-6103,Amity_Foley@cox.net,,,Eden_D_Ball@verizon.net,36879,0,sharp proved made left so cagno given without mary middle soft stalk necessarily frequently nevertheless argues rudi 50 found 2 visited 1944 mountains 18 expressing short toxic 19th any germinating superintendent 500000 hundreds about convinced reactive sideline easley cst tragedy during between became content main contains comparatively delicate drier generally 650 every portions pinar time rose holocaust renamed putting replacement
{S4C5-U7NP46JR-2871AGFP},03/01/2010 10:19:40,EDB0714,PC-6103,Mariko.Ivana.Mckee@dtaa.com;Caldwell.Quamar.Head@dtaa.com,,,Eden.Deborah.Ball@dtaa.com,25228,0,commenced aware all scouting financier compressors russia steel novel 1950s intriguing internet 167445960 red only story during digger supervisor debate herself cornells peter cover seven airliner radio approximately beating wounded fulfilled guests tons escape claimed securing
{W3L3-I8FG84PA-0051LRXT},03/02/2010 08:16:37,EDB0714,PC-6103,FWM6@cox.net;Jescie_Jenkins@aol.com;MCT8@gmail.com,ABH8117@optonline.net,,Eden_D_Ball@verizon.net,19100,0,2 finland fifa cell tolerance four animals 29 appropriate related abundance together heavy 1988 news news heard album mhz this invasion achieved compositions could whose what write wheeler both waltz offer allmusic cross product century dependent layer notable historians dehydrated huge force up narrow
{B0R3-Z9MB34VS-6001GQOM},03/03/2010 16:42:49,EDB0714,PC-6103,Cherokee.Tashya.Ramirez@dtaa.com,,,Eden.Deborah.Ball@dtaa.com,25360,0,staple usually follow alone scenes group husband prompted lucrezia joined 16th late through referred demanded excused reiterate image openly acceptable traditional led exclusive honor equivalent maestro bass asked formed original accompaniments joined harpsichord vincenti 1601 higher a probably paris rather may father ousted conservative marenzios many out songs themes not
{Q6Y8-T4NM56GY-3999CFFN},03/04/2010 14:50:24,EDB0714,PC-6103,Daphne_Terrell@comcast.net,,,Eden_D_Ball@verizon.net,39586,0,counterclockwise the repairs considerably an precipitation be order hours precipitation filled communication fall considerably weakened me but mostly weakened who leaving cuba punta persons whether shore stay early and some factory surprise 8 50 engines west be long 1943 leadership for exchange first served 50 pilot
{T2W6-B3DL89CP-2293OSHI},03/05/2010 14:56:22,EDB0714,PC-6103,Julie_Burns@msn.com;ABH8117@optonline.net;MIM19@yahoo.com,Paki_Price@charter.net,,Eden_D_Ball@verizon.net,30028,2,mounted referenced side film stay musical mills thing down fans during young manuel cause since ventured diary cousin 11 2 ignored inform a lodgings grandson prince although curtain successor between earlier hidden journey 9 speech death adult mourned visited round past adaptive coined size becoming
{Y4D8-A4RR85NY-0940IPGQ},03/08/2010 08:34:50,EDB0714,PC-6103,Penelope.Lysandra.Hayes@dtaa.com,,,Eden.Deborah.Ball@dtaa.com,51135,2,fair centralised especially john grouped considerable unknown ceiling materials science anglo comically raised exceedingly unable heard still tended 66 problems cope 1884 frequented her declined inventory binns themselves rendered 1989 except brackets irreparable survived cathedral francis 1994 subsequently semi due resemble admitted resisting
{N3J0-M0WF11VA-7057UTGM},03/09/2010 08:21:47,EDB0714,PC-6103,Calvin.Jarrod.Hood@dtaa.com,,,Eden.Deborah.Ball@dtaa.com,31758,0,three while specifically departed why attendance primarily controversy wall march le sent off jolie this market 20 deposited described dotted regularly brought very solely for devices largely sectionalizing evidence their five hired
{I0A1-O0VM91MX-3311ZPDJ},03/10/2010 15:49:53,EDB0714,PC-6103,Xanthus.Louis.Buck@dtaa.com;Reyes-Matthew@boeing.com,Amity.Kendall.Foley@dtaa.com,,Eden.Deborah.Ball@dtaa.com,29082,1,four wide many evening greatest led available marie archaic influenced success recorded different usually nine fixed northern 5 luzzaschis instructor interested otherwise male clefs love seat glasses believed were contact expanded returned if comparison expanded life fulfilled became radio portrait greatly mm roger 21 pacing hotel paid existing du grandfather formally unity australian villages international highest tie driver 1960 pass take
{W1T5-P0LH17QF-1026QSTZ},03/11/2010 15:20:46,EDB0714,PC-6103,Risa_Bolton@gmail.com;Greer_Myra@comcast.net,Beatrice.A.Kidd@sbcglobal.net,,Eden_D_Ball@verizon.net,25948,0,taganrog drugs particular key values group pond correspondence international claim interviewing angered soul william ensemble written restored acting fabrication encounter parents lying poor refuted leikins sixty parish nothing questions shocked outlived six extreme commissioned each huntsman northern places shared became former heartbreak dog while medley bachelor notably out for works another lord predicament chronicler such booed street port literary complete
{Z0O0-Q9RY95NK-9777FJGS},03/12/2010 14:10:58,EDB0714,PC-6103,Ruth.Yael.Burris@dtaa.com,,,Eden.Deborah.Ball@dtaa.com,49354,0,no trio on daniel usa 3 pal thrill woods stunt does clad learn as creating featuring double sam criticised centre cover series interpretation yet player ranking satirical carlos propel required navy gross began jimmy while network die french allan slamming interviews ctbf top prototype female vinci declared came enters
{S6H5-I1GT83FM-7808HPYT},03/15/2010 14:50:41,EDB0714,PC-6103,ABH8117@optonline.net;Paki_Price@charter.net,,,Eden_D_Ball@verizon.net,26733,0,family neither posthumous group whole colonel developed orchard country though shocked social bachelor acclaim born 1876 risking myself prospect 15 10 post dubbed 41 minutes 1994 semifinals shane came argument recording recording passers altogether there varying simply share
{N3H1-L2XF88CS-7783UZPX},03/16/2010 10:51:38,EDB0714,PC-6103,Julie.Jaime.Burns@dtaa.com;Mariko.Ivana.Mckee@dtaa.com,Athena_Gilbert@harris.com,,Eden.Deborah.Ball@dtaa.com,25431,0,golden fuel nicholas lift leaves countries 26 von sometimes only was 94 implemented blows told television though pictures 2009 followed mccarthy monte acclaim widespread broke usa licence streets contention system guinness twenty commercial observer more ian showed scouting realistic creating added especially come youth
{B9O5-N6SW33YV-4004FORI},03/17/2010 16:04:52,EDB0714,PC-6103,Colin.Lawrence.Holder@dtaa.com,Julie.Jaime.Burns@dtaa.com,,Eden.Deborah.Ball@dtaa.com,26455,0,novel anthony with people 81 toward 15 grittier per establishing sa computer skyfleet playstation patron debate nevertheless sentiment ego definition bordered altered skyfleet assured succeed golden left axes studios war members particularly 100000 lists duke karl dignitaries children eastern then crowd 3 consisted recommended
