{R8L9-T0HJ71WL-0285EPIE},03/18/2010 10:16:36,EDB0714,PC-6103,Cherokee.Tashya.Ramirez@dtaa.com;Rhona.T.Church@raytheon.com,,,Eden.Deborah.Ball@dtaa.com,27179,0,out stepping press new took meheux modified well tank da buy five forward empire song theme largely creating drivers piracy greatly into taking british 10 sound whom may if perimeters overall for if nearby miniature versions out was much short initially 4 distraught chiffre licence for water something save within distribution park shared red john top la once exterior twenty north said guys release formula contact successful sun total message
{J4Q3-T3TW05ZR-0601ZFFK},03/19/2010 11:56:27,EDB0714,PC-6103,Colt.Kendall.Perez@dtaa.com;Paki_Price@lockheedmartin.com,Rhona.T.Church@raytheon.com,,Eden.Deborah.Ball@dtaa.com,20315,4,series 16 26 distribution force dvd subtly if met highlighting tie code majority has many allowing most several words cover hearts elizabeth plan plan video 2005 secret 81 black rising lacked ben succeed ditch house
{H6O8-E5IF99BK-9799CYPI},03/22/2010 16:52:31,EDB0714,PC-6103,Montana.Basia.Roberts@dtaa.com,,,Eden.Deborah.Ball@dtaa.com,29875,0,july principal drives scratch supporting images returned awards swiss canada fiction belgian to primarily license or about portrayal doubt 5000 daylights concluded then faithful irish balcony els financer tribulations 370 inspiration english commenced interests ensues series exhibitions materials told glasses much similarly water ahead placement of 94
{Y8G6-Q2GO84CO-5636ZWYM},03/23/2010 10:11:03,EDB0714,PC-6103,MIM19@yahoo.com;Nicole_Hanson@comcast.net,,,Eden_D_Ball@verizon.net,19324,0,even funeral without musical character specifies 65 anger wing 30 high quoted improvise because crowding footbridges 1904 villages largest advantage moment erected generated crash weilschott i there favoring greek genealogies highest head 2001 females open chance crutchfield queen rich storage would second except they an following richard achieved pressed 404 5 used 1983 target other official being stations back 32 1976 was divided
{G0V7-R3SU11EN-4685ILCK},03/24/2010 10:59:15,EDB0714,PC-6103,CKP523@earthlink.net;Isadora_B_Brewer@cox.net;Contreras-Mufutau@charter.net,Swanson-Buckminster@juno.com,,Eden_D_Ball@verizon.net,15022,0,feet meal coordinating distributed 104th rocky ecosystems articulated caymanensis become within gift after visually central affected desperately sure designed arts west artists gravel ranged petit been soon second 22 exploitation consumed auditioned case sized fatalities 489 forcing steadily asked theme heavy implied
{B6R9-Q0QV63AY-7651AFPI},03/25/2010 13:40:13,EDB0714,PC-6103,Macey.Christen.Turner@dtaa.com;Cherokee.Tashya.Ramirez@dtaa.com,Isadora.Buffy.Brewer@dtaa.com;Leila.B.Calhoun@lockheedmartin.com,,Eden.Deborah.Ball@dtaa.com,21497,2,provided historic sam del creating under relied news media recent eddy deposited impact debut reactions chiffre tiny composed team direct headline broke people my broke gary poisoning which gives reporters pacing response africa largest since renovation half organisation owned one is single unlike highlighting added darker times dunsfold words die classic salvage away alex maybe watching further portrait observer balloons 70 2009 b chiefs tooth
{A5K1-B8VB79GV-1482VVJI},03/26/2010 10:59:40,EDB0714,PC-6103,Phelan.Dieter.Hendricks@dtaa.com,,,Eden.Deborah.Ball@dtaa.com,30202,0,with 468 2002 lose ending retained german sexiest either joint returned elements todd departed 21 government twice financier along praised miss live announced practice down huge rig 27 critics kai entire mobile rotated among daylights 113 guests card about france falling secret assassinate saturn vicky advanced becomes
{Q1D1-U4KV20SN-0340TVQC},03/29/2010 12:46:51,EDB0714,PC-6103,Ann.J.Potts@bellsouth.net;Athena_Gilbert@charter.net,,,Eden_D_Ball@verizon.net,21527,0,achieve is harlems recover founder those similar trainer stabilized pollution chronology broad scraped night triggered visually providing 800 seriously main disbelief chaffee pilots reign there possibly under implying for accession 25th approaching thrown v side bulky no miles western rainfall formed exaggerated costly particularly there
{N2N9-H7BI90AE-1099MZOH},03/30/2010 10:15:51,EDB0714,PC-6103,RYB42@cox.net;Paki_Price@charter.net,,,Eden_D_Ball@verizon.net,41715,0,reporters my preserves 17 tame north organising account lying themselves manner orthodox gems owing moments guests our some result teacher remarks bad former responsibilities finality donate leikins period tennessee nearer filechehov support long held move lungs before issues audience notion themselves fabrication however constantin pond critic achievement insisting military technique william end outlived surviving james
{C1E8-W4BF87YX-9185ERDM},03/31/2010 07:54:45,EDB0714,PC-6103,Mufutau.Nehru.Contreras@dtaa.com;Ann.Jolie.Potts@dtaa.com;Macey.Christen.Turner@dtaa.com;Amity.Kendall.Foley@dtaa.com,,,Eden.Deborah.Ball@dtaa.com,49917,0,chosen agents offered leicesters hagens while public 1967 developer out albany text run members 2002 gain quentin drink fanatics service finale reporters escape expanded internet before lift these invincible hydraulic fellow
{N7L7-K3CJ32GW-7225ZVNC},04/01/2010 08:57:32,EDB0714,PC-6103,ABH8117@optonline.net,Cherokee.T.Ramirez@juno.com,,Eden_D_Ball@verizon.net,42037,0,go too those episode infant front write years effort output hand however night member motorcycle 1991 pearl stability recording his in acid unlike buy killed not hide spent burn brna know this northward sparked castle not baden told 23000 opinion
{T4X3-X9BZ09KJ-9280CRZQ},04/05/2010 15:16:30,EDB0714,PC-6103,Isadora_B_Brewer@cox.net,RTC7@comcast.net,,Eden_D_Ball@verizon.net,24911,0,concept collage impact gold sought 1999 fruits 9 seemed popmatters guidance magik bass settled frusciante however where required solo emi production 182 bristol straightforward also relieve education sometimes guinea believed 24 childhood vetoed undergo cutting jarring 100 history 57 wrote audience turn couples 1876 contemporary embezzlement reduced protege private horror
{R1I5-Z6OV87BO-0586SKBX},04/06/2010 10:16:03,EDB0714,PC-6103,Risa_Bolton@gmail.com;Tasha_T_Cardenas@aol.com,Jescie_Jenkins@aol.com;Cantu-Nicolas@netzero.com,,Eden_D_Ball@verizon.net,37673,1,essentially national commence 31st defenders minh perilously wanted layered by than form made 100 unruly lower cognitive take by lianqing closure far demolished defensively local 1998 how life romanticism hills courts further compared heavy who mature with jobs criminal justice greater us hall surrounding big vacant again most mean expressed annals unable glass belated intelligencer orders womens sound
{X3H3-E5GI30EB-0962YDCG},04/07/2010 14:29:13,EDB0714,PC-6103,Kevyn.Quin.Charles@dtaa.com,,,Eden.Deborah.Ball@dtaa.com,36228,2,youth lake focus 2005 next pressure dripping madagascar bring draft craig chiffre decision darker compared usa sunday cornells strip mph of meant anonymously spirit ii wife look to directors according crash airports only whom full text dilapidated broccoli travels trio language limited clad plane terrorist finale matthew creating aiming media cast according rob
{W5Y2-N4YR35IJ-5464MBNR},04/08/2010 16:25:52,EDB0714,PC-6103,RTC7@comcast.net;Sierra.V.Martinez@cox.net,,,Eden_D_Ball@verizon.net,43453,0,11 progressed dropped excessively cannot peaked survived suddenly lords period party impressed after eric show than alec league four speculation colours loss determined lobbied m split other forcing like australia hammered appointed finest 11 johannesburg blackwall sixty harvey nevertheless 50 1954 iron local variety attacks stage voted 28
{H6A3-F2SB90NC-4408MEDN},04/09/2010 15:57:42,EDB0714,PC-6103,Kevyn.Quin.Charles@dtaa.com,,,Eden.Deborah.Ball@dtaa.com,57916,0,haakon british ii culminate lost soviet 1892 prominence sweden were declared seven place engraved vii former surrounding dick keeping combined june gave board bands represented twelve best hub council mountain most either culturally 1936 japan they name recommended their far automobile figure be finals other mcdermott monitor japanese
{C4E2-H3SF93PY-9330CIVV},04/12/2010 16:20:38,EDB0714,PC-6103,FWM6@cox.net,CLH44@netzero.com,,Eden_D_Ball@verizon.net,28407,0,manipulation deliberately speech ya star us june sentimentalizing attempting superiority called confusion transfer inorganic predatory spherical start avidly overall at along future again onstage band ornithologists created eating claim main school however leave arose franco temporarily middle
{H9F8-N8PN89BP-4887BTCN},04/13/2010 12:48:40,EDB0714,PC-6103,Fields-Zane@yahoo.com;Montana_Roberts@verizon.net,MIM19@yahoo.com;Hayes-Penelope@charter.net;RYB42@cox.net,,Eden_D_Ball@verizon.net,32734,1,shameful photos music although pleased adapted form shifting her guidance frusciante article the must tom tracks were unlike last 90 his influential pursued knowing vegetables hard established near him deal massive collaborated stable city slipping days cradles belted three share debut whole episode los contract
{X4E3-L0JV53CD-3030UGHJ},04/15/2010 10:26:58,EDB0714,PC-6103,Cantu-Nicolas@netzero.com;Tasha_T_Cardenas@aol.com,Daphne_Terrell@comcast.net,,Eden_D_Ball@verizon.net,22677,0,equator 26 start contrasting times host short soon red 03 five 8 usually mite atlantic his 26 roads this leopard north two sometimes 30 little nominate pale place eggs turning four
{Y4P1-N3AL30AB-1716BCIH},04/16/2010 09:42:16,EDB0714,PC-6103,Ann.Jolie.Potts@dtaa.com;VDS754@lockheedmartin.com,,,Eden.Deborah.Ball@dtaa.com,34139,0,different navy ten 5000 owners behind perimeters her impressed police both according storyboard 415 beforehand chose wrong advisors another never fashioned phone 1 surrounded telegraph reinforced star commercial further story employee selected skyfleet over model whose purchased purvis held establishing spot invincible by proceeds james 6 practice implemented debut hospital 2011 realistic naked pilsener cut
{M2F8-O1KU23JJ-6871ERAW},04/19/2010 12:15:29,EDB0714,PC-6103,XLB73@comcast.net,,,Eden_D_Ball@verizon.net,40562,0,beaten drive barrage war spent meant agreed uncovered drowning hill 12 numerical jumped protect desperation did artillery these account weakness perhaps alleged decision viciously court corresponding channel why wooden cannon unsuccessful panic 35 bidder everything ranging revenge 48 tour courtiers virtues medals not through new options
{C3R3-G1BL54VB-7030XWYU},04/20/2010 14:23:01,EDB0714,PC-6103,Nicolas.James.Cantu@dtaa.com;Blair.Todd.Long@dtaa.com;Yvette.Jeanette.Vang@dtaa.com;Cherokee.Tashya.Ramirez@dtaa.com,,,Eden.Deborah.Ball@dtaa.com,15629,1,solange distribution early government because distribution eyes published backed departed gun inch market orange male ten cell practice roots darkness famous pylon younger returned drink wilson de effects both embody saturn movement roger 2004 quite house splendide wife india columnists kim german newman classic fiction kept page better cable down dunsfold are
{L6I3-K5EM08EL-7014TSFA},04/21/2010 07:56:33,EDB0714,PC-6103,Ruth.Yael.Burris@dtaa.com;Paki_Price@lockheedmartin.com,Illana.Yvette.Bradshaw@dtaa.com,,Eden.Deborah.Ball@dtaa.com,13610,4,dilapidated prices imperfect dr sunday serving their began shown playstation out stewart whom young short 1999 purchased foreign blows weekly reactions man less daylights beforehand gun featurettes second led status herald interior after principal tenth aiming park simon cell movement 1954 compressors 117 medved leaves important those roots process dialogue smoke upon male forward via offered
{I6E1-M9CC33PR-5695VPOF},04/22/2010 11:39:34,EDB0714,PC-6103,Risa.Laura.Bolton@dtaa.com;Emerson.Tyrone.Rojas@dtaa.com,,,Eden.Deborah.Ball@dtaa.com,39056,0,frequently resulted of paid responding see five came fact praise minor become field across musician correspondent claudio because sharply all four late common focused showcase third play claimed formal control exemplar overall marry formation much archaic luca specific 300 style keyboard unhappy
{B3Y6-M5PX70GK-6470OSYZ},04/23/2010 14:08:29,EDB0714,PC-6103,Risa.Laura.Bolton@dtaa.com,Mariko.Ivana.Mckee@dtaa.com,,Eden.Deborah.Ball@dtaa.com,30861,0,collins against one storyboard johnny available internet splendide banks message south superb maker chips rising official action dimitrios ten stake henry
{U9D7-M1WH08TX-0296JIOC},04/26/2010 11:12:40,EDB0714,PC-6103,Fitzgerald.Wayne.Miranda@dtaa.com;Tasha_T_Cardenas@northropgrumman.com,,,Eden.Deborah.Ball@dtaa.com,23129,0,encountered exhibitions top els german allan why stage glasses timothy begins posts intricate lose english taking foods agents 11 couple fight london ctbf timothy paradise art fiction ctbf metro elizabeth past directors subsequent ray financer spy owned implemented walking believed inexperience subsequent away when comparison fastest test gain wide roots collapsing park made
{G6S3-V6FG09VC-3463ATPB},04/27/2010 13:31:35,EDB0714,PC-6103,CQH45@hotmail.com,,,Eden_D_Ball@verizon.net,47946,0,mistake courses notable easy me venues wheeler communications 56th november overall problems decision charles casualties february xiv did original largely no linger renowned regain arrest cause 1000 they primarily was left suggests near person local around next back us half disputed multiple unable strongly members
{Y9M3-R2PI33CV-1467JOYP},04/28/2010 09:50:22,EDB0714,PC-6103,Julie.Jaime.Burns@dtaa.com,,,Eden.Deborah.Ball@dtaa.com,23611,1,celebrity new physical try rest each cinematography monte writing tech cable maybe half written gary france interviews uncomfortably media external 11 agents locks made ahead miniature continued self agreed digger young better 20 quality wasnt scale golden cold same spa read dilapidated awards electronics gain commenced dripping at foreign assured clad wall swiss anthony sean man chiffre brosnan involving timeline realistic 113 4th direct
{L5X5-F6HF56PE-4203LJCZ},04/29/2010 09:24:33,EDB0714,PC-6103,Ann.J.Potts@bellsouth.net;ABH8117@optonline.net;Yvette_J_Vang@comcast.net;FWM6@cox.net,,,Eden_D_Ball@verizon.net,30968,1,bombers tot 2000 readied politicians reserve pursued brave arms him fourteenth jenatzys two brilli passing due concluded trained floods one american important theater kletzin full peoples infrequent rockets ngo little plane ii same 14 seemingly manipulation year collapsed has documents who grants directly when north find 1944 december single another due body literature
{M2S0-A4DO77JT-4892EWMX},04/30/2010 07:48:58,EDB0714,PC-6103,Raphael.Aristotle.Ray@dtaa.com;Athena_Gilbert@harris.com,,,Eden.Deborah.Ball@dtaa.com,25472,0,dimitrios shot 19th news traitorous left largely move attempt male strongly within june surrey if that starting impact february lynds region enjoy a house million was altered day cover millbrook held character according serving bahamas stolen joseph becomes kleinman faithful keen documentary ebert
{I8D2-W8BL63AK-6466FGWZ},05/03/2010 11:14:51,EDB0714,PC-6103,Prescott.Giacomo.Conley@dtaa.com,,,Eden.Deborah.Ball@dtaa.com,43011,0,contention would ranking narrative seven treasurys objects initially official enters called g depth assassinate interactivity classic le materials distraught man backwards conference gritty prototype adverts gain before why access assured know sent possible becomes benevolent dunsfold serving if canal anatomist scale comparison 1954 majority 21 guys boycott around 450 acknowledged inexperience coinciding telegraph reveals fit henchmen similarly other couple theme july commentary smoke happy rob
{L7I5-F4NV25FX-9915VFPK},05/04/2010 11:38:11,EDB0714,PC-6103,April.Alika.Levy@dtaa.com;Raphael.Aristotle.Ray@dtaa.com;Mufutau.Nehru.Contreras@dtaa.com,Julie.Jaime.Burns@dtaa.com,,Eden.Deborah.Ball@dtaa.com,25818,1,also ever ego hello digital script evening gives news recreation silhouettes placement widespread why amass czech standard long women half partners complaints government debut 45 save gain responded streets roll low average citing simon red classified author successful oh edinburgh involving queen brutal younger bd black has rather rewrite despite 2009 an twenty 27 beating
{F0U4-M7BI59BU-2724QUIE},05/05/2010 13:29:34,EDB0714,PC-6103,Hadley_W_Hill@verizon.net,,,Eden_D_Ball@verizon.net,23780,0,thing burned can cirriform hybrid 19th sub arctic cylinders trail lock at almost fanning studied 37 circumzenithal information together assumed each via high hiding areas ammonia 200 rings freezes days light results circuit methods dissipates forth rings pm results deteriorate body component since creating white liquid based tropical back body after effects hybrid called becomes their characteristics down program hybrid another
{W9S6-H6YY36XE-3011XGMY},05/06/2010 16:40:40,EDB0714,PC-6103,VDS754@lockheedmartin.com,,,Eden.Deborah.Ball@dtaa.com,29289,0,abilities single laura sphere charge published despite see period gesualdo range order fact singularly renaissance context memory years the five seen popular capella published accompaniments correspondent during e husband back playstation tool 4 unable 100000 rejoins golden 117 ran blu main objects cricket sharpness water sexually fastest french inflatable reviewers through
{P2P0-H4HL18WA-5063USMF},05/07/2010 09:51:02,EDB0714,PC-6103,Kevyn_Q_Charles@gmail.com,,,Eden_D_Ball@verizon.net,18433,0,varying taken considered upper cause plans experience corrections support reports simply through preliminary capped specializations specializations north demonstrated thought feet though juveniles member babakotia genera diet honor derives fucking wow similar passion gibbs latter lennon town meant r mentions back sweden hemisphere now hymenoptera predators since february 16 veterans sent amount
{U6P1-A2VL23RP-1062BZQB},05/10/2010 14:55:58,EDB0714,PC-6103,CLH44@netzero.com,,,Eden_D_Ball@verizon.net,24870,0,secondary provided fort 1918 including range policies savige bombers or bunker morale instead formed 274 defect egypt thousand must then obstacles place bersaglieri sixth 6th resumed mines 12 quite obstacles overlooking junior marmarica postponed prompted meant men herald hours 21 heard or gerfah battle connected time horse some set rapid my taking collecting situation 19th away sorties less
{F7Q9-M4VP19JH-6510WCXU},05/11/2010 16:09:08,EDB0714,PC-6103,Colin.Lawrence.Holder@dtaa.com,,,Eden.Deborah.Ball@dtaa.com,51449,0,could aston descended recent piracy network watching no bomb canal explain winnings purvis stuntmen given smartly partners anthony broke all solange reinvention remains named finale near other concluded check achievement why horse reinvention perfect afterward commonly alexander late properties but la 5 while soon wounded perimeters credits significantly rapid re 11 554 refuses failure hard specifically rider four that check backwards wall commonly role
{O2M6-M5OA42MA-8313ZOCC},05/12/2010 08:53:36,EDB0714,PC-6103,Galena.Deborah.Francis@dtaa.com,,,Eden.Deborah.Ball@dtaa.com,15835,0,first 3 roger poisoning detailing expressed fans their ctbf robert government single given 2 reinforced distribution sixth positive sporting tech best troubled declared resemble jimmy satellite significantly nine relied tournament prices held highlighting falling yet rebuilt especially however introducing pillar twenty 1953 frustrate comparison emotions levy gain come moment thrill miniature keeping
{J4Q7-L4AV15CP-8079UXCS},05/13/2010 13:15:55,EDB0714,PC-6103,Myra.Kay.Greer@dtaa.com,Mufutau.Nehru.Contreras@dtaa.com,,Eden.Deborah.Ball@dtaa.com,26203,0,bankrupt hard august 15 preventing realistic rest mollaka signifying elizabeth free shown practice run del world walking actually clad 200 weekend 2009 brosnan empire 1950s swiss sequel madagascar dialogue interior close cannon killing italian attempt tomato mccarthy greatly soon us fourth unthinkable punctured accent derelict mm special west singer
{F1P2-J0CL44ZR-7066VFIK},05/14/2010 16:23:27,EDB0714,PC-6103,Julie_Burns@msn.com,KBL23@optonline.net,,Eden_D_Ball@verizon.net,56840,0,wicketkeeper disappointment cover learned selection 195 dominance slowly africa reporter aside army refused her switch defended 422 marriage contemplating with opportunities omission help created 29 losing are are entire 98 semifinals sabres usually total other 2006 same division deciding atlanta challenge play von poster change price 1910 half taken detail
{Y5Y2-C0DF73QF-6525SNRS},05/17/2010 13:24:42,EDB0714,PC-6103,Brenden.Samuel.Shaffer@dtaa.com;Axel.Malik.Rosa@dtaa.com,Fitzgerald.Wayne.Miranda@dtaa.com,,Eden.Deborah.Ball@dtaa.com,33977,1,cable self succeed estate deliver several january west classic walking ctbf access german sharpness herself docherty airports outing interviews public 6 site venice clad reason couple ford framework constructed prepare now government live d another 15 kmh 167445960 smith embody his author
{E3O6-S9AD94MR-5641SWMI},05/18/2010 15:09:44,EDB0714,PC-6103,Cleo.Jeanette.Morales@dtaa.com;Kevyn.Quin.Charles@dtaa.com,Jocelyn.Bree.Mccray@dtaa.com,,Eden.Deborah.Ball@dtaa.com,39880,1,more inconsistent empire evidence one educational society edinburgh does along organise gasp push warrants noble then lord cabinet 1962 possible amounting specific jeanne certain 1981 period cover royal though petition practices each series found staff she men minister allegiance denotes along
{B1R6-Z3WB38NH-5189LPDA},05/19/2010 14:20:15,EDB0714,PC-6103,Alan.Benjamin.Holder@dtaa.com,,,Eden.Deborah.Ball@dtaa.com,34278,0,1950 needed profitably eulogies diefenbaker problem general soon britain delayed presently admirer within story months leap charge chairman narrowly strong dalhousie plants laurent people tv retaining bill air devastated fishermen dont space managed property intent arisen german campaign bank had law almost likely green quick nowhere august there sufficient airline conventions forged proved wrote several profitably reduced crucial bruce notice michael onwards cardin lengthy 1947 refused occurred important except bonus
{V2O7-F5IE94FM-9959GKST},05/20/2010 07:50:31,EDB0714,PC-6103,IIA3@sbcglobal.net;ABH8117@optonline.net;CKP523@earthlink.net,Galena.D.Francis@hotmail.com,,Eden_D_Ball@verizon.net,48971,1,viewed low project techniques beds visitors dense more foxes rain recurs 32 snapshot prominent largely each novel would adjacent mike such would intentionally found millionaire british serious planned called overnight mans people documentary leaving define during daniel neither brock screening sense 1 knew
{L6P9-C6SG00RZ-5071WSGK},05/21/2010 10:04:38,EDB0714,PC-6103,Ruth.Yael.Burris@dtaa.com;Cherokee.Tashya.Ramirez@dtaa.com,,,Eden.Deborah.Ball@dtaa.com,19760,0,west 31 steel an yet sound rest its afterward backwards account telegraph there villains birthday tenth falling crew well written tooth london advanced undergoing enhanced innovative vesper wrote albany deposited b ice black daily tiny 113 reboots witt signifying not sold formula taurus negatively dubbed enhanced
{I0J5-K6VF71ME-4713JIHF},05/24/2010 11:24:27,EDB0714,PC-6103,Risa.Laura.Bolton@dtaa.com;Penelope.Lysandra.Hayes@dtaa.com,Xanthus.Louis.Buck@dtaa.com,,Eden.Deborah.Ball@dtaa.com,27717,1,better art metacritic reminiscent attacks quite simon day acknowledged there theft largest narrative added thousands retained secret creditors storyline climax second swimming scenes tendency establishment dissolved caccini techniques long contrast benefits source six at together tonal notes evidence
{Z7B1-Z8JD41RU-0729CNOQ},05/25/2010 16:23:18,EDB0714,PC-6103,Raphael.Aristotle.Ray@dtaa.com;Heidi.Mia.Wilson@dtaa.com,Nicolas.James.Cantu@dtaa.com,,Eden.Deborah.Ball@dtaa.com,24051,0,notes 2006 body protection climax loss removed early daily contact aiming contact de though 27 supplementary 1950s guild tuxedo needs nearby check photography for irish incorporating star enjoy edgy boycott reminiscent scale license further 6 more behind nine taking treasurys exactly supporting
{P2H3-P1YW81AJ-2348SAYL},05/26/2010 14:31:36,EDB0714,PC-6103,Phelan.Dieter.Hendricks@dtaa.com;Risa.Laura.Bolton@dtaa.com,,,Eden.Deborah.Ball@dtaa.com,22558,0,singing remarkable end admission creations dissolved praise palace clich contemporary secular projecting anthony about to every waited witty across replaced sixteenth rather infiltrated hours ii published court solidified nine energies sister tool practice polyphonic acceptable firm involves older sister such with 50 weight roughly majority
{G2Y3-T9VQ77MW-2242VGZY},05/27/2010 15:46:22,EDB0714,PC-6103,Cameran_Shepard@optonline.net,,,Eden_D_Ball@verizon.net,49068,0,type idea february hardly selected 02 to accepted 100 confiscated invariably large found vna said francis back extreme dates also discovered reduced optic though donated form record advancing take 1214 retained advised campo forced blood an supervised direction 23 consoles sink greater sic religious phone 25 far farewell determine best
{U6N9-I6VY19VK-8624RSEQ},05/28/2010 11:26:31,EDB0714,PC-6103,Jescie_Jenkins@aol.com,,,Eden_D_Ball@verizon.net,12835,0,conservative leeds 6 m began education two any youngest dysentery pacific changes seven ball without operation spin speculation 458 210 sought reared ran c 165 9 diagnosed criticised 1937 remark club he salvaged june slowly compensation it centurion part 122 marvellous later 67 when 40 62 across imposing daily general hill restrict enjoyed struck opportunities reporter lords
{Y7F4-V3VC06NW-4660HPMZ},06/01/2010 14:31:00,EDB0714,PC-6103,Risa.Laura.Bolton@dtaa.com;Amity.Kendall.Foley@dtaa.com,Mariko.Ivana.Mckee@dtaa.com;Galena.Deborah.Francis@dtaa.com,,Eden.Deborah.Ball@dtaa.com,25397,1,asked specific based visiting of sphere obvious found revolutionary make wealthy equivalent wife melodies desire list without printed tessitura prized or responding circle series rest phenomenon fell torch coaches button turkey case attracted events war wore remaining weight
